ID,NAME,URL,WEBLAUNCHYEAR,PRIMEPHASEALPHA,PRIMEPHASENUMBER,FUNCTIONFREE,UI_FUNCTIONFREE,FUNCTIONCONTROLLLED,G-E-O-CATEGORY,UI_GEOCATEGORY,UI_FIELDUSE_AH,UI_FIELDUSE_SS,UI_FIELDUSE_LF,UI_FIELDUSE_PT,TWITTERACCOUNT,TWITTERFOLLOW_20160601,ACTIVEPRE,ACTIVEDIS,ACTIVEANA,ACTIVEWRI,ACTIVEPUB,ACTIVEOUT,ACTIVEASS,UI_REMARKS
1553,Research Involvement and Engagement,http://www.researchinvolvement.com/,2015,publish,24,"interdisciplinary health and social care journal co-produced by all key stakeholders, including patients, academics, policy makers and service users",,innovative journal,G,,,,,,no account,,,,,,V,,,
1551,Rio (Research ideas & Outcomes) Journal,http://riojournal.com/,2015,publish,24,integrated authoring / publishing / reviewing platform,,innovative journal,O/G,,,,,,https://twitter.com/RIOJournal,861,,,,,V,,V,
1376,ScienceOpen Research,https://www.scienceopen.com/collection/scienceopen_research?3,2014,publish,24,OA journal,,innovative journal,O,,,,,,https://twitter.com/SO_Research,799,,,,V,V (also peer review),,V,
1465,Scientific Data (Nature),http://www.nature.com/sdata/,2014,publish,24,data journal for papers describing datasets,,innovative journal,"O
",,,,,,https://twitter.com/ScientificData,5424,,,,,V,,,
1469,Self Journal of Science,http://sjscience.org/,2015,publish,24,"independent journal/publishing platform, aiming to ""to achieve optimal peer review, evaluation and classification of articles in a virtuously self-organized way""",,innovative journal,O,E,AH,SS,LF,PT,https://twitter.com/social_sjs,92,,,,,V,,"V
",
1127,ZooKeys journal,http://www.pensoft.net/page.php?P=14,2008,publish,24,journal publishing,,innovative journal,E,,,,,,https://twitter.com/ZooKeys_Journal,1819,,,,,V,V,,
1031,BMC (BiomedCentral),http://www.biomedcentral.com/,2000,publish,24,Gold OA publishing,,innovative journal platform/publisher,O,,,,,,https://twitter.com/BioMedCentral,39.1K,,,,,V,,,
1582,LingOA,http://www.lingoa.eu/,2015,publish,24,OA Publishing platform for linguistics,,innovative journal platform/publisher,O ,,,,,,no account,,,,,,V,,,
1614,PubPub,http://www.pubpub.org/,2016,publish,24,"open platform for creating, distributing, and reviewing publications. ",,innovative journal platform/publisher,O/G,,,,,,https://twitter.com/pubpub,383,,,,,V,,,
1018,SciELO (Scientific Electronic Library Online),http://www.scielo.org,1998,publish,24,Open Access journal platform for Latin America and Iberia,,innovative journal platform/publisher,O,,,,,,https://twitter.com/redescielo,33.9K,,V,,,V,,,
1109,WebMed Central,http://www.webmedcentral.com,2007,publish,24,Open Access biomedical publisher using post-publication peer review,,innovative publisher,O/G,,,,,,https://twitter.com/WebmedCentral,1278,,,,,V ,,(V),
1556,Archivist,https://medium.com/@_daniel/publish-interactive-historical-documents-with-archivist-7019f6408ee6,2015,publish,24,platform for publishing interactive interview transcriptions online,,innovative specialized publishing platform,E,,,,,,no account,,,,,,V,,,
1466,Biotaxa,http://biotaxa.org/,2012,publish,24,Online publishing platform for taxonomic journals ,,journal platform,"E/O
",,,,,,https://twitter.com/BiotaxaNews,235,,,,,V,,,
1602,Episciences,http://www.episciences.org/,2013,publish,24,platform to host epi-journals (overlay-journals),,"journal platform, for overlays",E/O,,,,,,no account,,,,,,V ,,,
1515,Revues.org,http://www.revues.org/,1999,publish,24,"platform for open journals, part of Open Edition (FR)",,"journal platform, Open Access",O,,,,,,https://twitter.com/revuesorg,4714,,,,,V,,,
1045,Creative Commons,http://creativecommons.org/,2002,publish,24,licensing&copyright for internet era,,licensing,O,,,,,,https://twitter.com/creativecommons,603K,,V?,,,V,,,
1032,DOI (Digital Object Identifier),http://www.doi.org/,2000,publish,24,permalink and disambiguation of publications,,persistant identifiers,E,,,,,,no account,,,V,,,V,V,,
1152,Datacite,http://www.datacite.org,2009,publish,24,develop standards for persistent identifiers for data,,"persistant identifiers, standards",E,,,,,,https://twitter.com/datacite,4126,,V,,,V,,,
1468,ProcPoS,https://www.peerageofscience.org/proceedings,2014,publish,24,Proceedings of Peerage of Science: peer-reviewed commentary journal,,platform for PPPR,O,,,,,,https://twitter.com/ProcPoS,78,,,,,V,,"V
",
1441,PressForward,http://pressforward.org/,2011,publish,24,Wordpress plugin for OA content aggregation and distribution/republication ,,republishing,O/E,,,,,,"https://twitter.com/pressfwd
",1116,,,,,V,V,,
1467,PaperNow,https://github.com/PeerJ/paper-now,2015,publish,24,"Create, edit and display a journal article in GitHub",,virtual journal article platform,O,,,,,,no account,,,,,V,V,,,
1034,Wikipedia (& Wikimedia Commons),www.wikipedia.org,2001,outreach/valorization,25,collaborative online general reference tool,,adding to broad popular resource,O,,,,,,https://twitter.com/Wikipedia,337K,,V,,,,V,,
1584,ExternalDiffusion,http://www.externaldiffusion.com/,2015,outreach/valorization,25,science blogging platform,,blogging network,O,,,,,,https://twitter.com/Ext_diffusion,2902,,,,,,V,,
1129,Hypotheses,http://hypotheses.org/,2008,outreach/valorization,25,"Academic blogging platform, part of Open Edition",,blogging network,O,,,,,,https://twitter.com/hypothesesorg,5917,,,,,,V,,
1427,Research Blogging,researchblogging.org,2008,outreach/valorization,25,collection/curation of blog posts about peer-reviewed research ,,blogging network,E,,,,,,https://twitter.com/ResearchBlogs,8792,,,,,,V,(V),
1091,ScienceBlogs,http://scienceblogs.com/,2006,outreach/valorization,25,science blogging network,,blogging network,O,,,,,,https://twitter.com/scienceblogs,11.9K,,,,,,V,,
1180,Scientopia,http://scientopia.org/,2010,outreach/valorization,25,science blogging network,,blogging network,O,,,,,,https://twitter.com/ScientopiaBlogs,3824,,,,,,V,,
1470,SciLogs,http://www.scilogs.com/,2011,outreach/valorization,25,"Group of science blogs
",,blogging network,E,,,,,,https://twitter.com/scilogscom,4695,,,,,,V,,
1438,Scienceseeker,http://scienceseeker.org,2011,outreach/valorization,25,Aggregator of science news and blogs,,blogging network & news,E,,,,,,https://twitter.com/SciSeeker,2519,,V,,,,V,,
1519,ECAST,"http://www.ecastnetwork.org/
",2010,outreach/valorization,25,Expert & Citizen Assessment of Science & Technology - A Distributed Network of Institutions for Peer to Peer Public Deliberation,,citizen assessment,G,,,,,,https://twitter.com/ECASTnetwork,30,,,,,,V,V,
1559,Frontiers for Young Minds,http://www.kids.frontiersin.org/,2013,outreach/valorization,25,web-based scientific journal with an editorial board of children (8-15yr),,"citizen review, by children",O,,,,,,https://twitter.com/FrontYoungMinds,1998,,,,,,V,,
1130,I Am Scientist,http://imascientist.ie/,2008,outreach/valorization,25,outreach to students through chat contest,,debating/discussing,O,,,,,,https://twitter.com/imascientist,13.3K,,,,,,V,,
1431,Open Science Showoff,http://www.scienceshowoff.org/,2011,outreach/valorization,25,Open mic night for science lovers,,debating/discussing,E,,,,,,https://twitter.com/ScienceShowoff,7664,,,,,,V,,
1260,Pint of Science,http://pintofscience.co.uk/,2012,outreach/valorization,25,Discussing science in a local pub,,debating/discussing,O,,,,,,https://twitter.com/pintofscience,11.1K,,,,,,V,,
1047,Sense about Science,http://www.senseaboutscience.org/,2002,outreach/valorization,25,activities and publications to change public discussions about science and evidence,,debating/discussing,G,,,,,,https://twitter.com/senseaboutsci,33.8K,,,,,,V,,
1068,Voice of Young Science (part of Sense about Science),http://www.senseaboutscience.org/pages/voys.html,2004,outreach/valorization,25,encourages early career researchers to play an active role in public debates about science,,debating/discussing,G,,,,,,https://twitter.com/voiceofyoungsci,3554,,,,,,V,,
1537,redditscience AMA (a.o. PLOS Science Wednesday),https://www.reddit.com/r/science/,2012,outreach/valorization,25,Discuss your science with broader community,,discussion,O,,,,,,https://twitter.com/Science_Reddit,,,,,,,V,,
1430,AskforEvidence,http://askforevidence.org/index,2014,outreach/valorization,25,"Tool to ask for evidence, or to share experience asking for evidence NB this is part of Sense About Science (ID1047)",,fact-checking,E/G,,,,,,https://twitter.com/senseaboutsci,33.8K,,,,,,V,(V),
1394,Fact Check Central,http://factcheckcentral.org/,2015,outreach/valorization,25,aggregated list of blogs from a selection of fact checking organisations,,fact-checking,O,,,,,,no account,,,,,,,V,,
1395,SciCheck,http://www.factcheck.org/scicheck/,2015,outreach/valorization,25,fact checking scientific claims made by US politicians to influence public policy,,fact-checking,O,,,,,,no account,,,,,,,V,,
1377,Draw Science,http://drawscience.blogspot.com/,2014,outreach/valorization,25,converts research papers into easy-to-read infographics,,infographics,O,,,,,,https://twitter.com/drawscience,808,,,,,,V,,
1545,JSTOR daily,http://daily.jstor.org/,2014,outreach/valorization,25,"linking news stories to scholarly research, with free access to JSTOR articles",,innovative journal,O/G,,,,,,https://twitter.com/JSTOR_Daily,8916,,,,,,V,,
1214,Limn,limn.it,2011,outreach/valorization,25,free journal for communicating exciting research in the social and human sciences,,innovative journal,O,,,,,,https://twitter.com/LimnMagazine,410,,,,,V,V,,
1521,United Academics,http://www.united-academics.org/,2009,outreach/valorization,25,"Magazine to bring science to the public; OA publisher; database of OA research papers, dissertations and theses; community",,innovative journal,O,,,,,,https://twitter.com/United_Science,1392,,V,,,V,V,,
1378,Elsevier Atlas,http://www.elsevier.com/atlas,2014,outreach/valorization,25,Republishing some selected high impact articles in lay-friendly format and OA,,"innovative journal, overlay",O,,,,,,https://twitter.com/ElsevierAtlas,693,,,,,,V,,
1046,HASTAC,http://www.hastac.org/,2002,outreach/valorization,25,"online community and social network for (mainly) DH, geared towards education/teaching",,online community,O,,,,,,https://twitter.com/HASTAC,14.9K,,,,,,V,,
1215,SocialScienceSpace,http://www.socialsciencespace.com/,2011,outreach/valorization,25,connect SS researchers and promote SS,,online community,O,,,,,,https://twitter.com/socscispace,8493,,,,,,V,,
1326,Kudos (pubs claimen en promoten),https://www.growkudos.com/,2013,outreach/valorization,25,"helps researchers explain, enrich and share their publications to increase research impact",,online promotion/linking of publications,O/E,,,,,,https://twitter.com/GrowKudos,1566,,,,,,V,V,
1128,AcaWiki,acawiki.org,2008,outreach/valorization,25,crowdsourced summaries and literature reviews of peer-reviewed research,,plain language short summaries,O,,,,,,https://twitter.com/acawiki,147,,,,,,V,,
1327,Nautilus 3 sentence science,http://tss.nautil.us/,2013,outreach/valorization,25,"three sentence lay abstracts, by the Nautil.us editor(s)",,plain language short summaries,O,,,,,,https://twitter.com/NautilusMag,36.6K,,,,,,V,,
1379,Publiscize,http://www.publiscize.com/,2014,outreach/valorization,25,"popularizing and spreading science (news) in author-written ""scinopses""",,plain language short summaries,O,,,,,,https://twitter.com/publiscize,186,,,,,,V,,
1329,ScienceGist [dead March 2015],http://www.sciencegist.com/,2013,outreach/valorization,25,simplified summaries of scientific papers,,plain language short summaries,O,,,,,,https://twitter.com/ScienceGist,595,,,,,,V,,
1330,Sciworthy,sciworthy.com,2013,outreach/valorization,25,"crowdsourced and curated short, visual intros to research followed by summary description that's also linked to published research",,plain language short summaries,O,,,,,,https://twitter.com/sciworthy,795,,,,,,V,,
1396,STM Digest,http://www.elsevier.com/connect/stm-digest-will-feature-lay-summaries-of-science-papers-with-societal-impact,2015,outreach/valorization,25,"Plain language summaries of science papers with societal impact, published online and next to the original article on ScienceDirect ",,plain language short summaries,O,,,,,,https://twitter.com/STMDigest,348,,,,,,V,,
1380,Useful Science,http://usefulscience.org/,2014,outreach/valorization,25,Crowdsourced and editorial one-sentence summaries of research articles,,plain language short summaries,O,,,,,,https://twitter.com/usefulsci,11.6K,,,,,,V,,
1216,The Conversation,http://theconversation.com/uk,2011,outreach/valorization,25,independent news and commentary website produced by academics and journalists. Free to read and republish.,,science journalism,O,,,,,,https://twitter.com/ConversationUK,55.8K,,,,,,V,,
1520,Before the abstract,http://www.beforetheabstract.com,2014,outreach/valorization,25,[science stories],,storytelling,G,,,,,,https://twitter.com/b4theabstract,538,,,,,,V,,
1536,Before the abstract = Springer Storytellers,http://www.beforetheabstract.com/,2014,outreach/valorization,25,storrytelling blog,,storytelling,G,,,,,,https://twitter.com/b4theabstract,538,,,,,,V,,
1075,Famelab,http://www.famelab.org/,2005,outreach/valorization,25,storytelling competition to communicate science to public audience,,storytelling,O,,,,,,https://twitter.com/famelabuk,4666,,,,,,V,,
1429,Open Science World,http://openscienceworld.com/,2014,outreach/valorization,25,Webzine' where scientist can post stories abt research (mostly reprints of stories published elsewhere?),,storytelling,E/O,,,,,,https://twitter.com/_OScience,8591,,,,,,V,,
1181,Story Collider,http://storycollider.org/,2010,outreach/valorization,25,personal stories about how science affects people (podcasts and live events),,storytelling,O,,,,,,https://twitter.com/story_collider,6593,,,,,,V,,
1428,The Open Notebook,sciworthy.com,2010,outreach/valorization,25,"Background information on creating stories about science. Writer interviews, topical features, pitch database & more",,storytelling,E,,,,,,https://twitter.com/open_notebook,5716,,,,,,V,,
1471,Three Minute Thesis (3MT),threeminutethesis.org/,2008,outreach/valorization,25,storytelling competition to communicate science to public audience,,storytelling,G,,,,,,https://twitter.com/3minutethesis,353,,,,,,V,,
1328,Real Scientists,http://realscientists.org/,2013,outreach/valorization,25,"rotational twitter account featuring real scientists, science writers, communicators and policy makers talking about their lives and their work",,using Twitter for outreach,O,,,,,,https://twitter.com/realscientists,33.9K,,,,,,V,,
1331,Silk,http://www.silk.co,2013,outreach/valorization,25,simple website creation based on database or spreadsheet,,website creation,O/E,,,,,,https://twitter.com/SilkDotCo,3160,,,,,V,V,,
1131,Academia.edu,http://www.academia.edu/,2008,researcher profiling (& social network),26,scholarly profiling and discussion,,academic social network,O,,,,,,https://twitter.com/academia,28.9K,,V,,,,V,,
1524,Academic Room,http://www.academicroom.com/,2011,researcher profiling (& social network),26,"academic social network - open communities to organize academic 
content ",,academic social network,E,,,,,,https://twitter.com/academicroom,4579,,,,,,V,,
1527,AuthorAID,http://authoraid.info/,2007,researcher profiling (& social network),26,"global network that provides support, mentoring, resources and training for researchers in developing countries",,academic social network,E,,,,,,https://twitter.com/authoraid,1343,,,,,,V,,
1522,Biowebspin,http://www.biowebspin.com/,2013,researcher profiling (& social network),26,social network for life sciences,,academic social network,E,,,,,,https://twitter.com/Biowebspin,2026,,,,,,V,,
1132,Epernicus Network,https://www.epernicus.com/network,2008,researcher profiling (& social network),26,academic social network,,academic social network,E,,,,,,https://twitter.com/Epernicus,60,,V,,,,V,,
1133,LabRoots,http://labroots.com/,2008,researcher profiling (& social network),26,"researcher social network website and producer of educational virtual events and webinars; members can also share workflows, protocols, labbooks etc. ",,academic social network,O,,,,,,https://twitter.com/LabRoots,4415,,V,,,,V,,
1526,Methodspace,http://www.methodspace.com/,2010,researcher profiling (& social network),26,"community around SAGE Research Methods
",,academic social network,E,,,,,,https://twitter.com/SAGE_Methods,10.7K,,,,,,V,,
1182,My Science Work,https://www.mysciencework.com/,2010,researcher profiling (& social network),26,researcher social network based on publications database,,academic social network,O,,,,,,https://twitter.com/MyScienceWork,6595,,V,,,,V,,
1528,Piirus,https://www.piirus.com,2014,researcher profiling (& social network),26,social network for researchers ,,academic social network,E,,,,,,https://twitter.com/piirus_com,3,,,,,,V,,
1474,Profology,www.profology.com,2012,researcher profiling (& social network),26,social network for academic staff and administrators (not students),,academic social network,E,,,,,,https://twitter.com/profology,3886,,,,,,V,,
1523,Research Connection,http://researchconnection.com/,2014,researcher profiling (& social network),26,social network for researchers ,,academic social network,E,,,,,,https://twitter.com/ResearchConn,2996,,,,,,V,,
1135,ResearchGate,http://www.researchgate.net,2008,researcher profiling (& social network),26,scholarly profiling and discussion,,academic social network,O,,,,,,https://twitter.com/ResearchGate,24.1K,,V,,,,V,V,
1525,ScholarBridge,http://www.scholarbridge.com/,2013,researcher profiling (& social network),26,connecting students and professors who share research interests,,academic social network,E,,,,,,https://twitter.com/ScholarBridge,267,,,,,,V,,
1472,Sciforum,http://sciforum.net/,2009,researcher profiling (& social network),26,"Discussion groups, online conferences",,academic social network,O/E,,,,,,https://twitter.com/sciforum,392,,,,,,V,,
1598,MLA Commons,https://commons.mla.org/,2012,researcher profiling (& social network),26,create groups and sites (MLA members),,"academic social network, field specific",E/O,,,,,,https://twitter.com/MLACommons,2203,,,,,,V,,
1606,Crastina,http://crastina.se/,2013,researcher profiling (& social network),26,"networking platform for the exchange of knowledge, skills, experience and opinion regarding scientific communication and science dissemination.",,academic social network?,E,,,,,,https://twitter.com/SciCrastina,261,,,,,,V,,
1473,AcademiaNet,http://www.academia-net.org/project/,2010,researcher profiling (& social network),26,Academic social network for female scientists,,academic social; network,E,,,,,,https://twitter.com/AcademiaNet_de,1397,,,,,,V,,
1261,Google Scholar Citations,http://scholar.google.com/citations,2012,researcher profiling (& social network),26,researcher profile based on GS records,,researcher profile,E,,,,,,no account,,,,,,,V,V,
1381,INCEND,http://www.incend.net/,2014,researcher profiling (& social network),26,"creating 'knowledge profiles' - including blogs, podcasts, tutorials, etc etc - aggregates content to communicate science outside academia",,researcher profile,O ,,,,,,https://twitter.com/TheIncentive,9899,,,,,,V,V?,
1262,ORCID,http://orcid.org/,2012,researcher profiling (& social network),26,author identification tool,,researcher profile,E,,,,,,https://twitter.com/ORCID_Org,11.6K,,,,,,V,V,
1134,ResearcherID,www.researcherid.com,2008,researcher profiling (& social network),26,researcher profile,,researcher profile,E,,,,,,https://twitter.com/ResearcherID,42,,,,,,V,V,
1432,SelectedWorks,http://works.bepress.com/,2004,researcher profiling (& social network),26,researcher profile,,researcher profile,O,,,,,,no account,,,,,,,V,,
1069,Vivo,vivoweb.org,2004,researcher profiling (& social network),26,linked data network (researcher profiling),,researcher profile,E,,,,,,https://twitter.com/VIVOcollab,1008,V?,V?,,,,V,,
1382,LOOP,http://loop.frontiersin.org/about,2014,researcher profiling (& social network),26,researcher profiles/network built around Frontiers and nature journals,,"researcher profile, academic social network",E,,,,,,no account,,,,,,,V,,
1052,Linkedin,https://www.linkedin.com/,2003,researcher profiling (& social network),26,Professional networking,,"researcher profile, social network",E,,,,,,https://twitter.com/LinkedIn,1.25M,,,,,,V,,
1384,Social-cite [dead],http://www.social-cite.org/,2014,comment,27,"social perception of value of references, mainly for physiology journals",,citation context,G,,,,,,https://twitter.com/socialcite,143,,,,,,,V?,
1025,NowComment,http://nowcomment.com/,1999,comment,27,Collaboratively comment on documents,,"comment, also collaboratively",O/E,,,,,,https://twitter.com/nowcomment,86,,V,,,,,V,
1332,PubMed Commons,http://www.ncbi.nlm.nih.gov/pubmedcommons/,2013,comment,27,commenting on PubMed papers by PubMed paper authors,,platform for PPPR,G,,,,,,https://twitter.com/PubMedCommons,3574,,,,,,,V,
1263,PubPeer,https://pubpeer.com/,2012,comment,27,post publication peer comments and discussion on PubMed papers,,platform for PPPR,G,,,,,,https://twitter.com/PubPeer,6772,,,,,,,V,
1383,Reffit,http://reffit.com/,2014,comment,27,"summmarize, discuss, praise, criticize papers and get your comments voted (in science & philosophy)",,platform for PPPR,G,,,,,,no account,,,,,,,,V,
1035,EGU Copernicus journals,http://www.atmospheric-chemistry-and-physics.net/,2001,peer review (post-pub),28,open peer review for Copernicus journals,,journal with PPPR,G,,,,,,no account,,,,,,V (peer review),,V,
1335,The Winnower,https://thewinnower.com/,2013,peer review (post-pub),28,multidisciplinary OA publishing platform with open multistage peer review,,journal with PPPR,G,,,,,,https://twitter.com/theWinnower,5853,,,,,V (also peer review),,V,
1183,Paper rejection Repository,http://grigoriefflab.janelia.org/rejections,2010,peer review (post-pub),28,deposit paper rejection information,,paper rejection information,G,,,,,,no account,,,,,,V,,V,
1333,Epistemio,http://www.epistemio.com/,2013,peer review (post-pub),28,rate and review publications; organize & export references,,platform for PPPR,G,,,,,,https://twitter.com/epistemio,37,,V?,,V?,,,V,
1217,PaperCritic,http://www.papercritic.com,2011,peer review (post-pub),28,post-pub peer review platform built on top of Mendeley,,platform for PPPR,O/G,,,,,,https://twitter.com/PaperCritic,334,,,,,,,V,
1218,Peer Evaluation [dead?],http://www.peerevaluation.org/,2011,peer review (post-pub),28," Open repository for data, papers, media coupled with an open review and discussion platform ",,platform for PPPR,O,,,,,,https://twitter.com/PeerEvaluation,2016,,,,,V,,V,
1264,Journal Lab,http://www.journallab.org/,2012,peer review (post-pub),28,community of scientists who share open summaries and peer review of published article (virtual journal club),,"platform for PPPR, journal club",O/G,,,,,,no account,,,,,,,V?,V,
1265,Wiki Journal Club,www.wikijournalclub.org,2012,peer review (post-pub),28,"open, user-reviewed summaries of medical research articles",,"platform for PPPR, journal club",E/O,,,,,,https://twitter.com/journalclubapp,253,,,,,,V,V?,
1475,Episciences,http://episciences.org/,2013,peer review (post-pub),28,"Technical platform for peer reviewing + promote the emergence of 'epi-journals'
for preprints (arVix, HAL) that have not been published elsewhere",,reviewing and virtual journals for preprints,G,,,,,,no account,,,,,,V (peer review),,V,
1433,PLoS ALM Reports,http://almreports.plos.org,2013,"measure impact (of output, e.g. article)",29,visualization of (aggregated) PLoS ALM data ,,ALM,E,,,,,,https://twitter.com/PLOSALM,1102,,,,,,,V,
1154,PLoS Article-Level Metrics,http://alm.plos.org/,2009,"measure impact (of output, e.g. article)",29,"suite of metrics for PLoS-articles (viewed, cited, saved, discussed, recommended)",,ALM,O/G,,,,,,https://twitter.com/PLOSALM,1102,,,,,,,V,
1219,Altmetric,http://www.altmetric.com/,2011,"measure impact (of output, e.g. article)",29,"providing alternative, article level metrics",,altmetrics,G,,,,,,https://twitter.com/altmetric,15.5K,,,,,,,V,
1476,BookMetrix,http://www.bookmetrix.com/,2015,"measure impact (of output, e.g. article)",29,(alt)metrics for books/book chapters,,altmetrics,G,,,,,,https://twitter.com/bookmetrix,360,,,,,,,"V
",
1266,ImpactStory,https://impactstory.org/,2012,"measure impact (of output, e.g. article)",29,altmetrics,,altmetrics,G,,,,,,https://twitter.com/Impactstory,7521,,,,,,,V,
1386,PLoS DLM (Data-level metrics),dlm.plos.org,2014,"measure impact (of output, e.g. article)",29,data-level metrics using PLoS ALM algorithm Lagotto,,altmetrics,O/G,,,,,,no account,,,,,,,,V,
1220,Plum Analytics,http://www.plumanalytics.com/,2011,"measure impact (of output, e.g. article)",29,altmetrics,,altmetrics,G,,,,,,https://twitter.com/PlumAnalytics,1449,,,,,,,V,
1586,iCite,https://icite.od.nih.gov/,2015,"measure impact (of output, e.g. article)",29,dashboard of bibliometrics (including RCR - relative citation ratio) for sets of articles in PubMed ,,article level metrics,G,,,,,,no account,,,,,,,,V,
1387,PLoS Rich Citations,http://alpha.richcitations.org/,2014,"measure impact (of output, e.g. article)",29,"detailed information about the citing paper, the cited object and the relationship between the two",,citation context,E,,,,,,no account,,,,,V,V,,,
1599,Depsy,http://depsy.org/,2015,"measure impact (of output, e.g. article)",29,impact of research software,,measure software usage,G,,,,,,https://twitter.com/depsy_org,419,,,,,,,V,
1385,Bipublishers,http://bipublishers.es/,2014,"measure impact (of output, e.g. article)",29,Bibliometric indicators for publishers,,publisher metrics,E,,,,,,no account,,,,,,,,V,
1397,DOI Chronograph,http://chronograph.labs.crossref.org/,2015,"measure impact (of output, e.g. article)",29,collect information about DOI-referrals from the open web,,support for citation analysis,O,,,,,,no account,,,,,,,,V,
