ID,NAME,URL,WEBLAUNCHYEAR,PRIMEPHASEALPHA,PRIMEPHASENUMBER,FUNCTIONFREE,UI_FUNCTIONFREE,FUNCTIONCONTROLLLED,G-E-O-CATEGORY,UI_GEOCATEGORY,UI_FIELDUSE_AH,UI_FIELDUSE_SS,UI_FIELDUSE_LF,UI_FIELDUSE_PT,TWITTERACCOUNT,TWITTERFOLLOW_20160601,ACTIVEPRE,ACTIVEDIS,ACTIVEANA,ACTIVEWRI,ACTIVEPUB,ACTIVEOUT,ACTIVEASS,UI_REMARKS
1233,LabFolder,https://www.labfolder.com/,2012,experiment & collect/mine/extract data,9,electronic lab notebook,,lab notebook,E,,,,,,https://twitter.com/labfolder,577,,V,V ,,,,,
1234,LabGuru,http://www.labguru.com/,2012,experiment & collect/mine/extract data,9,electronic lab notebook,,lab notebook,E,,,,,,https://twitter.com/Labguru,1901,,,V,,,,,
1121,Laboratory Logbook,http://lablog.sourceforge.net/,2008,experiment & collect/mine/extract data,9,document and manage lab data and metadata,,lab notebook,E,,,,,,no account,,,,V,,,,,
1080,eSurveys Pro,http://www.esurveyspro.com/,2006,experiment & collect/mine/extract data,9,online surveys,,online surveys,E,,,,,,no account,,,,V,,,,,
1120,FluidSurveys,http://fluidsurveys.com/,2008,experiment & collect/mine/extract data,9,online surveys,,online surveys,E,,,,,,https://twitter.com/FluidSurveys,5089,,,V,,,,,
1028,Free online Surveys,freeonlinesurveys.com,2000,experiment & collect/mine/extract data,9,online surveys,,online surveys,E,,,,,,no account,,,,V,,,,,
1355,Google Forms,http://www.google.com/forms/about/,2014,experiment & collect/mine/extract data,9,online surveys,,online surveys,E,,,,,,no account,,,,V,,,,,
1049,Limeservice,https://www.limeservice.com/en/,2003,experiment & collect/mine/extract data,9,Online survey creating and running,,online surveys,E,,,,,,https://twitter.com/LimeService,177,,,V,,,,,
1235,ProProfs Form maker,http://www.proprofs.com/form/,2012,experiment & collect/mine/extract data,9,Online forms creating and hosting,,online surveys,E,,,,,,https://twitter.com/proprofs,5060,,,V,,,,,
1452,Qualtrics,http://www.qualtrics.com/,2015,experiment & collect/mine/extract data,9,web surveying tool,,online surveys,E,,,,,,https://twitter.com/Qualtrics,17.1K,,,V,,,,,
1497,SmartSurvey Academic,https://www.smartsurvey.co.uk/academic-research-surveys,2010,experiment & collect/mine/extract data,9,survey tool ,,online surveys,E,,,,,,https://twitter.com/SmartSurvey,1002,,,V,,,,,
1168,Socialsci,https://www.socialsci.com/,2010,experiment & collect/mine/extract data,9,data collection platform: design surveys and recruit from participant pool,,online surveys,E,,,,,,https://twitter.com/socialsci,3,,,V,,,,,
1081,Survey Gizmo,http://www.surveygizmo.com,2006,experiment & collect/mine/extract data,9,online surveys,,online surveys,E,,,,,,https://twitter.com/SurveyGizmo,7439,,,V,,,,,
1020,SurveyMonkey,https://www.surveymonkey.com/,1999,experiment & collect/mine/extract data,9,online surveys,,online surveys,E,,,,,,https://twitter.com/SurveyMonkey,19.7K,,,V,,,,,
1409,TypeForm,http://www.typeform.com,2013,experiment & collect/mine/extract data,9,create surveys,,online surveys,E,,,,,,https://twitter.com/typeform,7790,,,V,,,,,
1563,OpenDataKit,https://opendatakit.org/,2008,experiment & collect/mine/extract data,9,"simple mobile data collection in field, with form, cloud storage and visualisation",,"online surveys, mobile",E,,,,,,https://twitter.com/OpenDataKit,1509,,,V,,,,,
1437,AllTrials,http://www.alltrials.net/,2013,experiment & collect/mine/extract data,9,campaign for preregistration of clinical trials,,preregistration,G,,,,,,no account,,V,,V,,V,,V,
1436,ClinicalTrials.gov,https://clinicaltrials.gov/,2000,experiment & collect/mine/extract data,9,preregistration of clinical trials,,preregistration,G,,,,,,no account,,V,V,V,,V,,V,
1435,Prospero,http://www.crd.york.ac.uk/PROSPERO/,2011,experiment & collect/mine/extract data,9,preregistration of systematic reviews,,preregistration,G,,,,,,https://twitter.com/crd_york,2369,V,V,V,,V,,V,
1495,Prolific Academic,https://prolificacademic.co.uk/,2015,experiment & collect/mine/extract data,9,recruit participants for online studies (crowdsourcing),,recruit participants,E,,,,,,https://twitter.com/ProlificAc,999,,,V,,,,,
1496,ResearchforGood,http://www.researchforgood.com/,2011,experiment & collect/mine/extract data,9,respondent samples for surveys; donates to charities/non-profits for every completed survey,,recruit participants,E,,,,,,https://twitter.com/ResearchForGood,881,,,V,,,,,
1494,Argo web based text mining,http://argo.nactem.ac.uk/,2012,experiment & collect/mine/extract data,9,web based text mining,,text mining,E,,,,,,no account,,,,V,,,,,
1357,Docollab,https://www.docollab.com/,2014,share notebooks / protocols / workflows,10,Research project management and publication of experiments,,lab management,O,,,,,,https://twitter.com/Docollab,25,,,V,,V,,,
1299,HiveBench,http://www.hivebench.com/,2013,share notebooks / protocols / workflows,10,electronic lab notebook with some Open protocols,,lab notebook,O/E,,,,,,https://twitter.com/hivebench,66,,,V,,V?,,,
1170,LabArchives,http://www.labarchives.com/,2010,share notebooks / protocols / workflows,10,electronic lab notebook (commercial provider); possibility to publish data publicly,,lab notebook,E/O,,,,,,https://twitter.com/LabArchives,373,,,V,,V?,,,
1083,Open Notebook Science,http://onsnetwork.org/ of 1st: http://usefulchem.wikispaces.com/,2006,share notebooks / protocols / workflows,10,open (lab)notebook,,lab notebook,O,,,,,,https://twitter.com/ONScience,814,,V,V,V?,V,V,,
1073,OpenWetWare,http://openwetware.org,2005,share notebooks / protocols / workflows,10,lab notebooks and community,,lab notebook,O,,,,,,https://twitter.com/openwetware,492,,(V),V,,,,,
1203,Sumatra,http://neuralensemble.org/sumatra/,2011,share notebooks / protocols / workflows,10,automated electronic lab notebook for computational projects - aims to aid reproducibility,,lab notebook,E/G,,,,,,no account,,,,V,,,,,
1021,Protocol online,www.protocol-online.org,1999,share notebooks / protocols / workflows,10,database of research protocols,,research protocol searching,O/E,,,,,,no account,,,,V,,V?,,,
1143,Benchfly,http://www.benchfly.com/,2009,share notebooks / protocols / workflows,10,video protocols and video platform for scientists,,research protocol sharing,O/E,,,,,,https://twitter.com/BenchFly,3154,,,V,,V?,,,
1298,Benchling,https://benchling.com/,2013,share notebooks / protocols / workflows,10,"data management and collaboration platform to create, find, and discuss protocols",,research protocol sharing,O/E,,,,,,https://twitter.com/benchling,3124,,,V,,V?,,,
1358,Protocols.io,http://www.protocols.io/,2014,share notebooks / protocols / workflows,10,sharing protocols,,research protocol sharing,O,,,,,,https://twitter.com/ProtocolsIO,752,,(V),V,,V?,,,
1454,Scientific Protocols,https://www.scientificprotocols.org,2014,share notebooks / protocols / workflows,10,"open source, open access scientific protocols",,research protocol sharing,O,,,,,,https://twitter.com/SProtocolsOrg,526,,,V,,,,,
1169,Crowdlabs,http://www.crowdlabs.org/,2010,share notebooks / protocols / workflows,10,share Vistrails workflows,,sharing workflows,O,,,,,,no account,,,,V,,,,,
1082,JoVe,http://www.jove.com/,2006,share notebooks / protocols / workflows,10,Video Journal for biomedicine,,sharing workflows,E,,,,,,https://twitter.com/JoVEjournal,5068,,,V,,V,,,
1099,myExperiment,http://www.myexperiment.org/,2007,share notebooks / protocols / workflows,10,"sharing workflows, esp. in bioinformatics",,sharing workflows,O,,,,,,no account,,,,V,,V?,,,
1300,Appsoma,https://appsoma.com,2013,analyze,11,"developing, running  and publishing code for science applications",,analysis platform/code,E,,,,,,https://twitter.com/Appsoma,9,,,V,,V?,,,
1301,Arvados,http://www.arvados.org/,2013,analyze,11,Virtual environment enabling reproducibility of data analysis with versioned scripts and tools,,analysis platform/code,G,,,,,,https://twitter.com/arvados,128,,,V,,,,,
1360,DHbox,http://dhbox.org/,2014,analyze,11,"cloud-based digital humanities lab, pre-equipped w/ IPython, RStudio, Omeka, and NLTK.",,analysis platform/code,E,,,,,,https://twitter.com/DH_Box,393,,,V,,,,,
1412,Galaxy,http://galaxyproject.org/,2005,analyze,11,"online data manipulation and analysis, for biomedical research but in principle field agnostic",,analysis platform/code,O/E,,,,,,https://twitter.com/galaxyproject,4545,,,V,,,,,
1144,GenePattern,http://www.broadinstitute.org/cancer/software/genepattern/,2009,analyze,11,genomic analysis platform that provides access to hundreds of genomics tools.,,analysis platform/code,E,,,,,,https://twitter.com/GenePattern,432,,,V,,,,,
1572,Google Cloud Datalab,https://cloud.google.com/datalab/,2015,analyze,11,interactive tool/platform  for exploring and visualizing data,,analysis platform/code,E/O,,,,,,no account,,,,V,(V),,,,
1204,IPython Notebook,http://ipython.org/notebook.html,2011,analyze,11,"editing document format that allows combination of executable code, txt, mathematics, plots and media; parallel computing",,analysis platform/code,E,,,,,,https://twitter.com/IPythonDev,7752,,,V,V?,,,,
1502,Jupyter,http://jupyter.org/,2015,analyze,11,Multi-language interactive computing environments - the future home of IPython notebook and related language-agnostic projects,,analysis platform/code,E,,,,,,https://twitter.com/ProjectJupyter,7980,,,V,V?,,,,
1609,Kaggle Datasets,https://kaggle.com/datasets,2016,analyze,11,discover and analyse public datasets [part of Kaggle],,analysis platform/code,O/E,,,,,,https://twitter.com/kaggle,51.5K,,,V,,V,,,
1060,Kepler,https://kepler-project.org/,2004,analyze,11,"create, execute, and share models and analyses; environment for integrating disparate software components",,analysis platform/code,E/O,,,,,,https://twitter.com/ProjectKepler,6,,,V,,,,,
1012,Kitware,http://www.kitware.com,1996,analyze,11,software solutions (many open-source) and support services for data-intensive R&D,,analysis platform/code,E/O,,,,,,https://twitter.com/Kitware,1835,,,V,,,,,
1171,OpenRefine (formerly Google Refine),http://openrefine.org/,2010,analyze,11,"cleaning and transforming data, extending data with other data from web services",,analysis platform/code,E/O,,,,,,https://twitter.com/OpenRefine,2367,,,V,,,,,
1062,Pegasus,http://pegasus.isi.edu/,2004,analyze,11,workflow management platform that helps workflow-based applications execute,,analysis platform/code,E,,,,,,no account,,,,V,,,,,
1237,ROpenSci,http://ropensci.org/,2012,analyze,11,packages to connect data/literature/metric/visualization etc. repositories/search engines to R using APIs,,analysis platform/code,E,,,,,,https://twitter.com/rOpenSci,9753,,V,V,,,,,
1063,Statcrunch,http://www.statcrunch.com/,2004,analyze,11,web-based data analysis,,analysis platform/code,E,,,,,,https://twitter.com/statcrunch,357,,,V,,,,,
1145,Voyeur/Voyant tools,"http://hermeneuti.ca/voyeur/ , http://voyeurtools.org/",2009,analyze,11,web-based text analysis environment,,analysis platform/code,E/O,,,,,,https://twitter.com/VoyantTools,660,,,V,,,,,
1238,Wakari,https://wakari.io/,2012,analyze,11,web-based python data analysis,,analysis platform/code,E,,,,,,no account,,,,V,,,,,
1043,BOINC,http://boinc.berkeley.edu/,2002,analyze,11,open source software for volunteer and grid computing,,collaboative computing,O/E,,,,,,https://twitter.com/BOINCprojects,3480,,,V,,,,,
1029,Folding@home,http://folding.stanford.edu/,2000,analyze,11,"Distributed computing project which studies protein folding, misfolding, aggregation, and related diseases",,collaborative computing,O/E,,,,,,https://twitter.com/foldingathome,1962,,,V,,,,,
1061,Open Science Grid,http://www.opensciencegrid.org/,2004,analyze,11,software to support collaborative computing,,collaborative computing,E,,,,,,https://twitter.com/opensciencegrid,143,,,V,,,,,
1434,Crowdcrafting,http://crowdcrafting.org/,2011,analyze,11,online tool for making crowdsourcing projects,,crowdsourced/collaborative analysis,E,,,,,,https://twitter.com/crowdcrafting,758,V,,V,,,,,
1359,Crowdfindings,http://www.crowdedtheory.com/,2014,analyze,11,Crowdsourced social science analysis,,crowdsourced/collaborative analysis,E/O,,,,,,no account,,,,V,,,,,
1456,Foldit,http://www.fold.it,2008,analyze,11,citizen science project in protein folding,,crowdsourced/collaborative analysis,E,,,,,,https://twitter.com/Foldit,1142,,,V,,,,,
1100,Galaxy Zoo (part of Zooniverse),http://www.galaxyzoo.org/,2007,analyze,11,crowdsourced science,,crowdsourced/collaborative analysis,E,,,,,,https://twitter.com/galaxyzoo,12.9K,,,V,,,,,
1302,GCAT,http://www.bioplanet.com/gcat,2013,analyze,11,share and compare results of different analysis tools on same datasets ,,crowdsourced/collaborative analysis,G,,,,,,no account,,,,V,,,,,
1455,Polymath,http://michaelnielsen.org/polymath1/,2009,analyze,11,massively collaborative online mathematical projects,,crowdsourced/collaborative analysis,E/G,,,,,,no account,,"(V)
",,V,,,,,
1172,Project Noah,http://www.projectnoah.org/,2010,analyze,11,citizen science (studying wildlife),,crowdsourced/collaborative analysis,O,,,,,,https://twitter.com/projectnoah,8869,,,V,,,,,
1205,SciStarter,http://scistarter.com/,2011,analyze,11,database of citizen science projects,,crowdsourced/collaborative analysis,E/O,,,,,,https://twitter.com/SciStarter,7233,,V?,V,,,,,
1022,SETI@home,https://seti.berkeley.edu/,1999,analyze,11,crowdsourced computer power for analysis (citizen science); finding intelligent life outside earth,,crowdsourced/collaborative analysis,E,,,,,,https://twitter.com/setiathome,8926,,,V,,,,,
1304,Snapzen,https://snapzen.com/screen-capture,2013,analyze,11,collaboratively discuss / analyze screen captures,,crowdsourced/collaborative analysis,G,,,,,,https://twitter.com/SnapzenCo,1959,,V,V,,,,,
1457,Socientize,http://www.socientize.eu,2012,analyze,11,citizen science network for infrastructure providers and researchers to recruit participants ,,crowdsourced/collaborative analysis,E,,,,,,https://twitter.com/SOCIENTIZE,868,(V),,V,,,,,
1362,Synapse (Sage),https://www.synapse.org/,2014,analyze,11,"platform for ""open collaborative data analysis""",,crowdsourced/collaborative analysis,G,,,,,,https://twitter.com/sagebio,3718,,,V,,,,,
1101,Zooniverse,https://www.zooniverse.org/,2007,analyze,11,crowdsourced analysis (citizen science),,crowdsourced/collaborative analysis,O/E,,,,,,https://twitter.com/the_zooniverse,14.3K,,,V,,,,,
1541,Nomenklatura,http://nomenklatura.okfnlabs.org/,2012,analyze,11,data cleaning - alias reconciliation,,data cleaning,,,,,,,no account,,,,V,,,,,
1303,Plasmid.io,http://www.shazino.com/#plasmidio,2013,analyze,11,Manage plasmids,,lab management,E,,,,,,https://twitter.com/Plasmid_io,27,,,V,,,,,
1361,Riffyn,http://www.riffyn.com,2014,analyze,11,Process design and analysis software for reproducible research and development ,,project management,G/E,,,,,,https://twitter.com/Riffyninc,,,,V,,,,,
1173,Circos table viewer,http://mkweb.bcgsc.ca/tableviewer/,2010,visualize,12,Online application of Circos to visualize tabular data,,create graphs,E,,,,,,no account,,,,V,V,,,,
1611,Datahero,https://datahero.com/,2011,visualize,12,cloud-based data analysis and visualization (charts and dashboards),,create graphs,E,,,,,,https://twitter.com/datahero,1695,,,,V,,,,
1414,Datawrapper,https://datawrapper.de/,2012,visualize,12,creating charts and maps online,,create graphs,E,,,,,,https://twitter.com/Datawrapper,2539,,,V,V,,,,
1503,Debategraph,http://debategraph.org,2008,visualize,12,cloud based platform for mapping and supporting debates,,create graphs,E/O,,,,,,https://twitter.com/DebateGraph,3564,,,V,,,,,
1122,Google Charts,https://developers.google.com/chart/,2008,visualize,12,create live and interactive charts in your browser,,create graphs,E,,,,,,no account,,,,V,V,,,,
1146,Google Fusion Tables,https://support.google.com/fusiontables/answer/2571232,2009,visualize,12,"data visualization web application to gather, visualize, and share data tables",,create graphs,E,,,,,,https://twitter.com/GoogleFT,11K,,,V,V,,,,
1363,Lynks,http://lynksoft.com/,2014,visualize,12,online networks visualization,,create graphs,E,,,,,,no account,,,,V,,,,,
1364,Palladio,palladio.designhumanities.org,2014,visualize,12,web-based visualization tool for complex humanities data,,create graphs,E,,,,,,no account,,,,V,V,,,,
1239,Plot.ly,http://plot.ly,2012,visualize,12,create graphs (collaboratively),,create graphs,E,,,,,,https://twitter.com/plotlygraphs,18K,,,V,V,,,,
1415,QIword,https://qiword.co/,2014,visualize,12,Analyze keyword interaction from a library of papers,,create graphs,E,,,,,,https://twitter.com/qiword_official/,431,,,V,,,,,
1305,Raw,http://raw.densitydesign.org/,2013,visualize,12,Open web app to create custom vector-based visualizations using D3.js library ,,create graphs,E,,,,,,https://twitter.com/densitydesign,7208,,,V,V,,,,
1050,Tableau,http://www.tableausoftware.com,2003,visualize,12,data visualization software (also online),,create graphs,E,,,,,,https://twitter.com/tableau,85.4K,,,V,V,,,,
1417,Tableau online,http://www.tableau.com/products/online,2013,visualize,12,Online visualization tool,,create graphs,E,,,,,,https://twitter.com/tableau,85.4K,,,V,V,,,,
1505,TAGS Explorer,http://hawksey.info/tagsexplorer/,2011,visualize,12,visualize Twitter networks (based on TAGS),,create graphs,E,,,,,,https://twitter.com/mhawksey,6150,,,V,,,,,
1504,Timeline.js,http://timeline.knightlab.com/,2013,visualize,12,interactive timeline visualizations ,,create graphs,E,,,,,,https://twitter.com/TimelineJS,1202,,,V,V,,,,
1123,Image-maps,http://www.image-maps.com/,2008,visualize,12,making clickable image-maps,,create images,E,,,,,,https://twitter.com/imagemapping,3351,,,V,V,,,,
1413,CartoDB,http://cartodb.com/,2012,visualize,12,creation and hosting of dynamic online maps,,create maps,E,,,,,,https://twitter.com/cartoDB,19.8K,,,V,V,,,,
1124,Ushahidi Platform,http://www.ushahidi.com/product/ushahidi/,2008,visualize,12,Interactive mapping of social media data,,create maps,E/O,,,,,,https://twitter.com/ushahidi,61.1K,,,V,V,,,,
1206,World Map,http://worldmap.harvard.edu/,2011,visualize,12,Build maps and other geospatial visualizations,,create maps,E,,,,,,no account,,,,V,V,,,,
1533,Worldmap Harvard,http://worldmap.harvard.edu/,2011,visualize,12,Online map creation,,create maps,,,,,,,no account,,,,V,V,,,,
1416,Nodegoat,http://nodegoat.net/,2014,visualize,12,"web-based data management, analysis & visualisation environment",,create network visualizations,E,,,,,,https://twitter.com/nodegoat,152,,,V,V,,,,
1506,VOS Viewer,www.vosviewer.com,2010,visualize,12,"network visualization 
",,create network visualizations,E,,,,,,https://twitter.com/cwtsleiden,664,,,V,,,,,
1147,VisualEyes,http://www.viseyes.org/viseyes.htm,2009,visualize,12,online creation of visual and dynamic presentations,,create web presentations,E,,,,,,no account,,,,,V,,,,
1604,Penelope,http://www.peneloperesearch.com/,2015,write (+ code),13,checking manuscripts for common scientific errors (including compliance with guidelines) ,,checking manuscripts,E/G,,,,,,https://twitter.com/penelope_rsrch,115,,,,V,,,,
1307,ASCII doctor,http://asciidoctor.org/,2013,write (+ code),13,Ruby tool for AsciiDoc>HTML5 conversion,,conversion,E,,,,,,https://twitter.com/asciidoctor,542,,,,V,,,,
1084,Pandoc,http://johnmacfarlane.net/pandoc/,2006,write (+ code),13,Text format converter,,conversion,E,,,,,,no account,,,,,V,,,,
1306,Activepapers,http://www.activepapers.org/,2013,write (+ code),13,File format for publishing code/computations: data plus code working on those data,,creating dynamic/executable publications,E,,,,,,https://twitter.com/ActivePapers,70,,,,V,,,,
1207,Collage Authoring Environment,https://collage.elsevier.com/,2011,write (+ code),13,authoring environment for executable publications,,creating dynamic/executable publications,E,,,,,,no account,,,,(V),V,,,,
1208,Knitr,http://yihui.name/knitr/,2011,write (+ code),13,dynamic reporting with R; facilitate reproducible research,,creating dynamic/executable publications,E/G,,,,,,https://twitter.com/xieyihui,6744,,,(V),V,,,,
1562,RMarkdown,http://rmarkdown.rstudio.com/,2014,write (+ code),13,"combine manuscript writing with Markdown with code, plots & data from R",,creating dynamic/executable publications,G/E,,,,,,no account,,,,,V,,,,
1044,Sweave,http://www.statistik.lmu.de/~leisch/Sweave/,2002,write (+ code),13,embed R code for complete data analyses in LaTeX documents,,creating dynamic/executable publications,E/G,,,,,,no account,,,,V,V,,,,
1565,Shiny,http://shiny.rstudio.com/,2014,write (+ code),13,turning R code into web application,,creating web applications,E/O,,,,,,no account,,,,,V,,,,
1064,AJE (American Journal Experts),http://www.aje.com/en,2004,write (+ code),13,"proofreading, translation, editing by PhD students",,improving drafts,E,,,,,,no account,,,,,V,,,,
1148,PaperRater,http://www.paperrater.com/,2009,write (+ code),13,"online grammar check; plagiarism detector, writing suggestions",,improving drafts,E,,,,,,https://twitter.com/PaperRater,1676,,,,V,,,,
1575,Peerwith,https://www.peerwith.com/,2015,write (+ code),13,manuscript editing services [marketplace],,manuscript editing marketplace,E,,,,,,https://twitter.com/peerwithcom,62,,,,V,,,,
1576,Comwriter,http://comwriter.com/,2013,write (+ code),13,Online template based writing,,online writing,E,,,,,,https://twitter.com/comwriter,184,,,,V,,,,
1065,Markdown,http://en.wikipedia.org/wiki/Markdown,2004,write (+ code),13,Simple text editing markup language,,online writing,E,,,,,,https://twitter.com/markdown,1608,,,,V,,,,
1603,COBWEB,http://cochrane.fr/writingtool/testwebsite,2015,write (+ code),13,"online writing template, preformatted to comply with CONSORT guidelines for reporting trials",,online writing with restricting format,G,,,,,,no account,,,,,V,,,,
1240,Authorea,https://www.authorea.com/,2012,write (+ code),13,online colloborative writing,,"online writing, also collaboratively",O,,,,,,https://twitter.com/authorea,2192,,,,V,V,,(V),
1573,BlueLaTeX,https://www.bluelatex.org,2011,write (+ code),13,collaborative document writing/editing,,"online writing, also collaboratively",E,,,,,,https://twitter.com/BlueLaTeX_team,7,,,,V,,,,
1308,Draft,https://draftin.com/,2013,write (+ code),13,(collaboratively) writing and versioning drafts,,"online writing, also collaboratively",E,,,,,,https://twitter.com/natekontny,11.8K,,,,V,,,,
1309,Fiduswriter,http://fiduswriter.org/,2013,write (+ code),13,Online (collaborative) text editing with simple ref manager and image database,,"online writing, also collaboratively",E,,,,,,https://twitter.com/fiduswriter,313,,,,V,,,,
1102,Google Docs,https://drive.google.com,2007,write (+ code),13,online text/spreadsheet/presentation editing,,"online writing, also collaboratively",E,,,,,,https://twitter.com/googledrive,1.6M,,,V,V,,,,
1241,Google Drive,https://drive.google.com,2012,write (+ code),13,online text/spreadsheet/presentation editing,,"online writing, also collaboratively",E,,,,,,https://twitter.com/googledrive,1.6M,,,V,V (also collectively),,,,
1458,Manuscript App,http://www.manuscriptsapp.com/,2015,write (+ code),13,"Dedicated editor for planning, outlining, editing, collaborating and sharing of scholarly research",,"online writing, also collaboratively",E,,,,,,https://twitter.com/manuscriptapp,2,,,,V,,,,
1023,NoodleTools,http://www.noodletools.com/,1999,write (+ code),13,"teaching tool for collaborative research and writing, note taking, reference management and drafting",,"online writing, also collaboratively",E,,,,,,https://twitter.com/noodletools,1241,,,,V,,,,
1365,Overleaf,https://www.overleaf.com/,2014,write (+ code),13,broad platform for (collaborative) writing with easy links for reviewing and publishing [was: WriteLaTeX],,"online writing, also collaboratively",O,,,,,,https://twitter.com/writelatex,26.7K,,,,V,(V),,(V),
1547,Papeeria,https://papeeria.com/,2013,write (+ code),13,online LaTeX editor and plot compiler for collaborative writing,,"online writing, also collaboratively",E,,,,,,https://twitter.com/Papeeria,231,,,,V,,,,
1310,Penflip,https://www.penflip.com/,2013,write (+ code),13,collaborative writing and version control,,"online writing, also collaboratively",E,,,,,,https://twitter.com/PenflipApp,274,,,,V,,,,
1366,Poetica,http://poetica.com,2014,write (+ code),13,collaborative online text editor for teams,,"online writing, also collaboratively",E,,,,,,https://twitter.com/poetica,1683,,,,V,,,,
1311,Quip,https://quip.com/,2013,write (+ code),13,"oline collaborative writing and document sharing / ""productivity app""; also spreadsheets",,"online writing, also collaboratively",E,,,,,,https://twitter.com/quip,6363,,,,V,,,,
1242,Scalar,http://scalar.usc.edu/scalar/,2012,write (+ code),13,"free, open source authoring and publishing platform; combining media and semantic",,"online writing, also collaboratively",E/O,,,,,,https://twitter.com/anvcscalar,1209,,,,V,V,,,
1243,ShareLatex,https://www.sharelatex.com/,2012,write (+ code),13,LaTex collaborative editor/sharing platform (paid),,"online writing, also collaboratively",E,,,,,,https://twitter.com/sharelatex,2907,,,,V,,,,
1368,Typewrite,https://typewrite.io/,2014,write (+ code),13,"A simple, real-time collaborative writing environment.",,"online writing, also collaboratively",E,,,,,,https://twitter.com/Typewrite_io,88,,,,V,,,,
1244,WriteLaTeX,https://www.writelatex.com/,2012,write (+ code),13,collobarative simulataneous LaTex editing,,"online writing, also collaboratively",E,,,,,,https://twitter.com/writelatex,68,,,,V,,,,
1074,Git,http://git-scm.com/,2005,write (+ code),13,Version control for websites and software,,version control,E,,,,,,no account,,,,,V,(V),,,
1174,Dexy,http://dexy.it/,2010,write (+ code),13,documentation tool for writing documents incorporating code,,writing,E,,,,,,https://twitter.com/dexyit,534,,,,V,,,,
1006,LateX,http://www.latex-project.org/,1984,write (+ code),13,command controlled text editing/formatting,,writing,E,,,,,,no account,,,,,V,,,,
1367,RASH,http://cs.unibo.it/save-sd/rash/index.html,2014,write (+ code),13,simple html markup language using only 24 elements,,writing,E,,,,,,no account,,,,,V,,,,
