ID,NAME,URL,WEBLAUNCHYEAR,PRIMEPHASEALPHA,PRIMEPHASENUMBER,FUNCTIONFREE,UI_FUNCTIONFREE,FUNCTIONCONTROLLLED,G-E-O-CATEGORY,UI_GEOCATEGORY,UI_FIELDUSE_AH,UI_FIELDUSE_SS,UI_FIELDUSE_LF,UI_FIELDUSE_PT,TWITTERACCOUNT,TWITTERFOLLOW_20160601,ACTIVEPRE,ACTIVEDIS,ACTIVEANA,ACTIVEWRI,ACTIVEPUB,ACTIVEOUT,ACTIVEASS,UI_REMARKS
1391,Memento Timetravel service,http://timetravel.mementoweb.org/,2015,search (lit/data/patents/code),3,metasearch for previous versions of webpages suing 10+ webpage archives,,"search engine, historical",E,,,,,,no account,,,V,,,,,,
1037,Aquabrowser,http://www.proquest.com/products-services/AquaBrowser.html,2002,search (lit/data/patents/code),3,discovery layer over library catalogue,,search interface enhancement,E,,,,,,https://twitter.com/aquabrowser,309,,V,,,,,,
1398,Arrowsmith,http://arrowsmith.psych.uic.edu/cgi-bin/arrowsmith_uic/start.cgi,2002?,search (lit/data/patents/code),3,identifying meaningful links between two sets of PubMed literature,,search interface enhancement,E,,,,,,no account,,,V,,,,,,
1339,EvidenceFinder,http://labs.europepmc.org/evf,2014,search (lit/data/patents/code),3,enriches literature exploration in Europe PMC by suggesting questions (based on full-text results) alongside search results,,search interface enhancement,E,,,,,,https://twitter.com/ElsevierAotF,740,,V,,,,,,
1275,Paperscape,http://paperscape.org/,2013,search (lit/data/patents/code),3,Visualisation built on  ArXiV,,search interface enhancement,E,,,,,,no account,,,V,,,,,,
1224,Wikidata,http://www.wikidata.org,2012,search (lit/data/patents/code),3,Storage of structured data for wikimedia products,,search/use data,E,,,,,,https://twitter.com/wikidata,6243,,V,,,,,,
1161,EDS (Ebsco Discovery Service),http://www.ebscohost.com/discovery,2010,search (lit/data/patents/code),3,webscale discovery search engine,,web scale discovery search engine,E,,,,,,no account,,,V,,,,,,
1113,Primo,http://www.exlibrisgroup.com/category/PrimoOverview,2008,search (lit/data/patents/code),3,web scale discovery service,,web scale discovery search engine,E,,,,,,no account,,,V,,,,,,
1140,Summon,http://www.proquest.com/products-services/The-Summon-Service.html,2009,search (lit/data/patents/code),3,web scale discovery service,,web scale discovery search engine,E,,,,,,no account,,,V,,,,,,
1077,Worldcat Discovery,https://www.worldcat.org/,2006,search (lit/data/patents/code),3,webscale discovery of library holdings,,web scale discovery search engine,E,,,,,,no account,,,V,,,,,,
1095,Worldcat Local,http://www.oclc.org/worldcat-local.en.html,2007,search (lit/data/patents/code),3,webscale configurable discovery service for libraries,,web scale discovery search engine,E,,,,,,no account,,,V,,,,,,
1405,HowOpenIsIt? Open article gauge,http://oag.cottagelabs.com/,2013,get access,4,determine license for journal articles,,determine license,E,,,,,,no account,,,V,,,,,,
1279,Open Access Button,https://www.openaccessbutton.org/,2013,get access,4,"raises awareness about (lack of) Open Access; offers alternative ways to get paywalled paper (repositories, contact author)",,get access by promoting OA,O,,,,,,https://twitter.com/OA_Button,6228,,V,,,,,,
1345,Scoap3,scoap3.org,2014,get access,4,collaboratively flipping journals to OA,,get access by promoting OA,O,,,,,,no account,,,V,,,V,,,
1193,Unglue it,https://unglue.it/,2011,get access,4,crowdfunding to make specific books freely available with CC-license,,get access by promoting OA,O,,,,,,https://twitter.com/unglueit,1109,,,,,V,V,,
1117,Deepdyve,https://www.deepdyve.com/,2008,get access,4,Pay-per-view access to scholarly publications,,publication vendor,E,,,,,,https://twitter.com/deepdyve,1275,,V,,,,,,
1041,Hinari,http://extranet.who.int/hinari/en/journals.php,2002,get access,4,reduced price access program,,reduced publication price / waivers,O,,,,,,https://twitter.com/R4LPartnership,1478,,V,,,,,,
1162,"Research4life (in 4 UN programmes HINARI, AGORA, AORE, ARDI)",http://www.research4life.org,2010,get access,4,reduced priced access program,,reduced publication price / waivers,O,,,,,,https://twitter.com/R4LPartnership,1478,,V,,,V,,,
1284,Sparrho,http://sparrho.com/,2013,get alerts/recommendations,5,TOC/content alerting in feed format,,alert for resources based on TOCs or search terms,E,,,,,,https://twitter.com/sparrho,1246,,V,,,,,,
1280,Flypapers,https://twitter.com/fly_papers,2013,get alerts/recommendations,5,"Twitterbot of Drosophila papers in PubMed, ArXiV, BioRxiv, PeerJ and F1000 ",,"alert for resources based on TOCs or search terms, field specific",E,,,,,,https://twitter.com/fly_papers,1385,,V,,,,,,
1281,Nowomics,http://nowomics.com/,2013,get alerts/recommendations,5,news feed for biological data and publications,,"alert for resources based on TOCs or search terms, field specific",E,,,,,,https://twitter.com/nowomics,358,,V,,,,,,
1283,Scizzle,http://myscizzle.com/,2013,get alerts/recommendations,5,alerting tool built on PubMed,,"alert for resources based on TOCs or search terms, field specific",E,,,,,,https://twitter.com/myScizzle,759,,V,,,,,,
1282,PubChase,https://www.pubchase.com/,2013,get alerts/recommendations,5,alerting & recommendations; personal library sharing,,"alert for resources based on TOCs or search terms, field specific, also collaborative",E,,,,,,https://twitter.com/PubChase,521,,V,,,,,,
1225,Sciencescape,https://sciencescape.org/,2012,get alerts/recommendations,5,Alerting & sharing papers in life sciences,,"alert for resources based on TOCs or search terms, field specific, also collaborative",E,,,,,,https://twitter.com/sciencescape,15,,V,,,,,,
1194,Browzine,http://thirdiron.com/browzine/,2011,get alerts/recommendations,5,TOC/content alerting and PDF-reader (mobile app),,"alert for resources based on TOCs or search terms, multifield",E,,,,,,https://twitter.com/browzine,95,,,,,,,,
1118,JournalTocs (previously TicTocs),http://www.journaltocs.hw.ac.uk/,2008,get alerts/recommendations,5,TOC-alerting,,"alert for resources based on TOCs or search terms, multifield",E,,,,,,https://twitter.com/journaltocs,1341,,V,,,,,,
1226,TiNYARM ('This is not yet another reference manager'),http://atinyarm.appspot.com,2012,get alerts/recommendations,5,"share and suggest reading activities with peers, so that these can act as an information filter",,give and get recommendations,E,,,,,,no account,,,V,,,,,,
1042,F1000 (Biology),http://f1000.com/prime,2002,get alerts/recommendations,5,recommendations,,recommendation by experts,E,,,,,,no account,,,V,,,,,V,
1163,F1000 Prime,http://f1000.com/prime,2010,get alerts/recommendations,5,recommendations,,recommendation by experts,E,,,,,,no account,,,V,,,,,V,
1285,CERMINE,http://cermine.ceon.pl/index.html,2013,reference management,6,extract metadata from scholarly PDF's,,extract metadata from publications,E,,,,,,no account,,,V,,,,,,
1011,QUOSA,http://www.elsevier.com/online-tools/quosa,1996,reference management,6,enterprise reference management & full text management,,full text management for groups,E,,,,,,https://twitter.com/QUOSA1,64,,V,,,,,,
1346,ACS ChemWorx,https://hp.acschemworx.acs.org/,2014,reference management,6,collaborative reference manager coupled with tools and services for authors,,reference management,E,,,,,,https://twitter.com/ACSChemWorx,986,,V,,V,,,,
1195,Bibliogo,http://info.bibliogo.com/,2011,reference management,6,reference management; alerts and PDF workflow,,reference management,E,,,,,,https://twitter.com/bibliogodev,,,V,,V,,,,
1286,Google Scholar Library,http://scholar.google.com/scholar?scilib=1,2013,reference management,6,"simple reference management, restricted to GS records",,reference management,E,,,,,,no account,,,V,,V?,,,,
1228,PaperPile,https://paperpile.com/,2012,reference management,6,web-based reference management tool,,reference management,E,,,,,,https://twitter.com/pprpile,1774,,V,,V,,,,
1544,RefBank,http://refbank.refindit.org/RefBank/search,2012,reference management,6,"collaborative bibliography of biodiversity literature; nodes for different organizations, publishers (like Pensoft)",,reference management,O/E,,,,,,no account,,,V,,V,,,,
1348,RefME,https://www.refme.com/,2014,reference management,6,"online reference manager;  search by book/journal article title, DOI, ISBN, ISSN or copy/paste URL, scan book bar code",,reference management,E,,,,,,https://twitter.com/GetRefME,14.9K,,V,,V,,,,
1406,Stackly (disc. from 20150901),https://www.stackly.org,2014,reference management,6,"reference management tool, with shared 'stacks'to track",,reference management,E/O,,,,,,https://twitter.com/stacklysupport,8,,V,,,,,,
1072,BibSonomy,http://www.bibsonomy.org/,2005,reference management,6,Share bookmarks and lists of literature.,,reference management & sharing,E,,,,,,https://twitter.com/BibSonomyCrew,243,,V,,,,,,
1078,CiteUlike,http://www.citeulike.org/,2006,reference management,6,reference management & sharing,,reference management & sharing,E/O,,,,,,https://twitter.com/citeulike,1271,,V,,V,,,,
1048,Citavi,https://www.citavi.com/,2003,reference management,6,reference management,,"reference management, with cite/bibliography options",E,,,,,,https://twitter.com/citavi,1680,,V,,V,,,,
1550,Cite This For Me,https://www.citethisforme.com/,2012,reference management,6,"Reference management tool, shared bibliographies",,"reference management, with cite/bibliography options",E,,,,,,https://twitter.com/CiteThisForMe,452,,V,,V,,,,
1227,Colwiz,https://www.colwiz.com/,2012,reference management,6,reference management,,"reference management, with cite/bibliography options",E,,,,,,https://twitter.com/colwiz,687,,V,,V,,,,
1196,Docear,http://www.docear.org/,2011,reference management,6,"reference manager, writing platform, w/ mindmapping feature, literature suggestions based on mindmaps",,"reference management, with cite/bibliography options",E,,,,,,https://twitter.com/Docear_org,1152,,V,,V,,,,
1007,EndNote,http://endnote.com/,1988,reference management,6,reference management,,"reference management, with cite/bibliography options",E,,,,,,https://twitter.com/EndNoteNews,3782,,V,,V,,,,
1347,F1000 Workspace (formerly beta),http://f1000.com/beta/,2014,reference management,6,"reference management, making/sharing annotations in papers, commenting on references",,"reference management, with cite/bibliography options",E,,,,,,https://twitter.com/F1000,18.9K,,V,,V,,(V),,
1119,Mendeley,http://www.mendeley.com/,2008,reference management,6,reference management,,"reference management, with cite/bibliography options",E/O,,,,,,https://twitter.com/MendeleySupport,7448,,V,,V,,V,V,
1549,PaperBox,http://www.paper-box.co/,2012,reference management,6,cloud-based reference + pdf management system,,"reference management, with cite/bibliography options",E,,,,,,https://twitter.com/peaya,87,,V,,V,,,,
1096,PapersApp (Mekentosj -),http://www.papersapp.com/,2007,reference management,6,reference management,,"reference management, with cite/bibliography options",E,,,,,,https://twitter.com/papersapp,4900,,V,,V,,,,
1287,Proquest Flow,https://flow.proquest.com/,2013,reference management,6,reference management,,"reference management, with cite/bibliography options",E,,,,,,no account,,,V,,V,,,,
1005,Reference Manager,http://www.refman.com/,1984,reference management,6,reference management,,"reference management, with cite/bibliography options",E,,,,,,no account,,,V,,V,,,,
1033,RefWorks,http://www.refworks.com/,2001,reference management,6,reference management,,"reference management, with cite/bibliography options",E,,,,,,https://twitter.com/RefWorks,4021,,V,,V,,,,
1079,Zotero,https://www.zotero.org/,2006,reference management,6,reference management,,"reference management, with cite/bibliography options",E/O,,,,,,https://twitter.com/zotero,13.2K,,V,,V,,,,
1164,Qiqqa,http://www.qiqqa.com/,2010,reference management,6,free reference manager,,"reference management, with citing/bibliography options",E,,,,,,no account,,,V,,V,,,,
1097,Wizfolio,http://wizfolio.com/,2007,reference management,6,"online reference management tool, also for mp3, video, weblinks etc. ",,"reference management, with citing/bibliography options",E,,,,,,https://twitter.com/wizfoliosupport,54,,V,,V,,,,
1098,JCB dataviewer,http://jcb-dataviewer.rupress.org/,2007,read/view,7,viewing multidimensional images from JCB journal,,image viewer,E,,,,,,no account,,,V,,,,,,
1198,Readcube,https://www.readcube.com/,2011,read/view,7,"recommendations, PDF-reader, annotator, reference management",,PDF reader with extra options,E,,,,,,https://twitter.com/readcube,2704,,V,,(V),,,,
1230,Utopiadocs,http://utopiadocs.com/,2012,read/view,7,PDF reader esp. for scholarly docs suggesting related literature based on what you read,,PDF reader with extra options,E,,,,,,https://twitter.com/utopiadocs,485,,V,,,,,,
1288,CrossMark,http://www.crossref.org/crossmark/,2013,read/view,7,show information on the version and updates of a publication,,reading enhancement,E/G,,,,,,https://twitter.com/CrossRefNews,6454,,V,,,,,,
1555,Ferret,http://ferret.ai/,2015,read/view,7,Chrome extension for life sciences summarizing/enriching articles and providing full-text search based on reading history.,,reading enhancement,E,,,,,,https://twitter.com/getferret,244,,V,,,,,,
1197,Incontext,https://code.google.com/p/surf-incontext/,2011,read/view,7,navigate through RDF relations in a smooth and understandable way,,reading enhancement,E,,,,,,no account,,,V,,,,,,
1229,PubReader,http://www.ncbi.nlm.nih.gov/pmc/about/pubreader/,2012,read/view,7,alternative web presentation to read literature in PMC and Bookshelf (code in GitHub),,reading enhancement,E,,,,,,no account,,,V,,,,,,
1349,Wiley Anywhere Article,http://olabout.wiley.com/WileyCDA/Section/id-819787.html,2014,read/view,7,Enhanced HTML article from Wiley publisher.,,reading enhancement,E,,,,,,no account,,,V,,,,,,
1231,Wiley Smart Article,http://onlinelibrary.wiley.com/subject/code/000128/homepage/new.htm,2012,read/view,7,Enhanced article tools for chemistry content in Wiley journals,,reading enhancement,E,,,,,,no account,,,V,,,,,,
1449,Annotag Calculator,http://jonreeve.com/projects/annotags/,2014,annotate/tag (during/after reading),8,"literary annotation protocol: create annotation hashtag  ('annotag') based on ISBN, page(s)
",,annotation protocol,E,,,,,,https://twitter.com/j0_0n,334,,V,,,,,,
1199,Hypothes.is,http://hypothes.is,2011,annotate/tag (during/after reading),8,"annotating, commenting and tagging tool",,annotation tool,O,,,,,,https://twitter.com/hypothes_is,4444,,,,V?,,,V,
1350,Annotate.co,https://www.annotate.co/about.html,2014,annotate/tag (during/after reading),8,Annotate and collaborate on documents and images,,"annotation, also collaborative",E,,,,,,https://twitter.com/Annotateco,340,,V,,V,,,,
1447,Annotated Books Online,http://www.annotatedbooksonline.com/,2012,annotate/tag (during/after reading),8,annotation platform for early modern books,,"annotation, also collaborative","E/O
",,,,,,https://twitter.com/AboBooks,2692,,V,,,,,,
1491,Annotation Studio,http://www.annotationstudio.org/,2013,annotate/tag (during/after reading),8,suite of collaborative web-based annotation tools (currently under development at MIT),,"annotation, also collaborative",E,,,,,,https://twitter.com/MIThyperstudio,2121,,V,V,V,,,,
1351,Cochrane EMBASE screening project,http://screening.metaxis.com/EMBASE/login.php,2014,annotate/tag (during/after reading),8,classify research abstracts of RCTs in Embase  for inclusion in Cochrane CENTRAL,,"annotation, also collaborative",E/G,,,,,,no account,,,V,,,,,,
1448,HistoryPin,https://www.historypin.org/,2010,annotate/tag (during/after reading),8,crowdscourced community platform collaborating around history,,"annotation, also collaborative",E/O,,,,,,https://twitter.com/Historypin,12K,,V,,,,,,
1352,Mark2Cure,https://mark2cure.org/,2014,annotate/tag (during/after reading),8,crowdsourced annotation of biochemical papers,,"annotation, also collaborative",E/G,,,,,,https://twitter.com/Mark2Cure,1107,,V,,,,,,
1289,PeerLibrary,http://peerlibrary.org,2013,annotate/tag (during/after reading),8,collaborative annotating; discovery,,"annotation, also collaborative",O,,,,,,https://twitter.com/PeerLibrary,435,,V,,,,,,
1290,ResQuotes,http://www.resquotes.com,2013,annotate/tag (during/after reading),8,saving and organizing Kindle quotes and web text snippets,,"annotation, also collaborative",E,,,,,,no account,,,V,,,,,,
1499,TBE Validator service,http://www.teibyexample.org/xquery/TBEvalidator.xq,2013,experiment & collect/mine/extract data,9,web-based validator for XML-encoded text,,code/text validator,"E
",,,,,,https://twitter.com/TEIconsortium,1894,,,V,,,,,
1493,Dedoose,http://www.dedoose.com/,2010,experiment & collect/mine/extract data,9,"cross-platform app for analyzing qualitative and mixed methods research with text, photos, audio, videos, spreadsheet data and more",,collect & visualize data,E,,,,,,https://twitter.com/Dedoose,952,,,V,,,,,
1293,ManyLabs,https://www.manylabs.org/,2013,experiment & collect/mine/extract data,9,tools and documentation for citizen science,,crowdsourced/collaborative analysis,O/E,,,,,,https://twitter.com/manylabs,250,,,V,,,,,
1610,Bellingcat,https://bellingcat.checkdesk.org/en,2014,experiment & collect/mine/extract data,9,collaborative space for journalist led and citizen participating fact-checking,,data extraction,E,,,,,,https://twitter.com/bellingcat,27.3K,,,V,,,,,
1166,Google NGram Viewer,https://books.google.com/ngrams,2010,experiment & collect/mine/extract data,9,chart frequencies of words/short sentences in Google Books,,data extraction,E,,,,,,no account,,,,V,,,,,
1291,Import.io,https://import.io/,2013,experiment & collect/mine/extract data,9,"Turning web into data (scraping, parsing etc.); not restricted to scholarly use",,data extraction,E,,,,,,https://twitter.com/importio,23.7K,,,V,,,,,
1546,Morph.io,https://morph.io/,2014,experiment & collect/mine/extract data,9,automated web-scraping,,data extraction,E/O,,,,,,https://twitter.com/morph_io,194,,,,,,,,
1059,PDF Miner,http://www.unixuser.org/~euske/python/pdfminer/index.html,2004,experiment & collect/mine/extract data,9,Extracting information from PDF documents,,data extraction,E,,,,,,no account,,,,V,,,,,
1408,ScraperWiki,https://scraperwiki.com/,2009,experiment & collect/mine/extract data,9,extract/scrape tables from PDFs,,data extraction,E,,,,,,https://twitter.com/ScraperWiki,3868,,,V,,,,,
1296,Tabula,http://tabula.technology/,2013,experiment & collect/mine/extract data,9,extract data from pdf tables,,data extraction,E,,,,,,https://twitter.com/TabulaPDF,1146,,,V,,,,,
1500,TAGS,https://tags.hawksey.info/,2010,experiment & collect/mine/extract data,9,Google Sheet template which lets you setup and run automated collection of search results from Twitter,,data extraction,E,,,,,,https://twitter.com/mhawksey,6150,,,V,,,,,
1202,WebPlotDigitizer,http://arohatgi.info/WebPlotDigitizer/,2011,experiment & collect/mine/extract data,9,"Extract data from plots, graphs, maps etc",,data extraction,E,,,,,,https://twitter.com/ankit_rohatgi,162,,,V,,,,,
1498,Liquid,https://getliquid.io/,2014,experiment & collect/mine/extract data,9,mobile data collection,,"data form
",E,,,,,,https://twitter.com/LQDdata,402,,,V,,,,,
1165,1degreebio,http://1degreebio.org/,2010,experiment & collect/mine/extract data,9,find reagents & lab products,,equipment & research objects,E,,,,,,https://twitter.com/1DegreeBio,4686,,,V,,,,,
1058,Addgene,https://www.addgene.org/,2004,experiment & collect/mine/extract data,9,plasmid sharing platform,,equipment & research objects,E,,,,,,https://twitter.com/Addgene,3680,,,V,,,,,
1027,Biocompare,http://www.biocompare.com/,2000,experiment & collect/mine/extract data,9,lab equipment reviews,,equipment & research samples,E,,,,,,https://twitter.com/biocompare,3531,,,V,,,,,
1492,BioMedUSA,http://biomedusa.org/,2013,experiment & collect/mine/extract data,9,sharing and licensing of biological research materials and related technologies,,equipment & research samples,E,,,,,,no account,,,,V,,,,,
1451,GeoSamples (SESAR),http://www.geosamples.org/,2004,experiment & collect/mine/extract data,9,search and register geosamples and get GEOsample ID (IGSN),,equipment & research samples,E,,,,,,https://twitter.com/igsn_info,70,,,V,,,,,
1356,Resource Identification Portal,http://scicrunch.com/resources,2014,experiment & collect/mine/extract data,9,"providing, discovering and citing research resources (organisms, antibodies, tools) based on RRIDs",,equipment & research samples,E/G,,,,,,no account,,,V,V,V ,,,,
1294,Sample of Science,https://www.sampleofscience.net/,2013,experiment & collect/mine/extract data,9,Marketplace for (physical) sample sharing. Samples get published and receive DOI,,equipment & research samples,E/G,,,,,,https://twitter.com/SampleofScience,556,,,V,,,,,
1019,Selectscience,http://www.selectscience.net/,1999,experiment & collect/mine/extract data,9,"independent, online review resource for lab equipment and techniques",,equipment & research samples,E,,,,,,https://twitter.com/selectscience,3661,,,V,,,,,
1295,StrainControl,http://www.straincontrol.com/,2013,experiment & collect/mine/extract data,9,lab inventory tool,,equipment & research samples,E,,,,,,https://twitter.com/StrainControl,,,,V,,,,,
1617,DISK,http://disk-project.org/,2016,experiment & collect/mine/extract data,9,Automated discovery of scientific knowledge (automate the hypothesize-test-evaluate discovery cycle) [login required],,experiment,E,,,,,,no account,,,V,,,,,,
1501,Emerald Cloud Lab,http://emeraldcloudlab.com,2014,experiment & collect/mine/extract data,9,web-based life sciences lab -run experiments in a central lab from anywhere in the world,,experiment,E,,,,,,https://twitter.com/emeralddna,656,,,V,,,,,
1232,GenomeCompiler,http://www.genomecompiler.com/,2012,experiment & collect/mine/extract data,9,Genetic design platform (manipulate and design everything from single genes to entire genomes),,experiment,E,,,,,,https://twitter.com/GenomeCompiler,1988,,,V,,,,,
1571,Tatool,http://www.tatool.ch/,2015,experiment & collect/mine/extract data,9,Run computer based experiments (web and download) ,,experiment,E,,,,,,https://twitter.com/tatool_ch,70,,,V,,,,,
1236,Wings,www.wings-workflows.org,2012,experiment & collect/mine/extract data,9,semantic workflow system that assists scientists with the design of computational experiments,,experiment,E,,,,,,no account,,,,V,,,,,
1453,Crowdtruth,"http://crowdtruth.org/
",2013,experiment & collect/mine/extract data,9,"framework for crowdsourcing annotation data on text, images and videos",,"experiment, collaborative or outsourced",E,,,,,,https://twitter.com/CrowdTruth,2,,V,V,,,,,
1411,CurateScience,https://curatescience.org/,2015,experiment & collect/mine/extract data,9,online platform to facilitate replication by aggregating data/syntax files and enabling curation,,"experiment, collaborative or outsourced",E/G,,,,,,https://twitter.com/eplebel,301,,,V,,,,,
1407,Experimonths,http://science.experimonth.com/,2009,experiment & collect/mine/extract data,9,citizen science; month-long challenges to collect data ,,"experiment, collaborative or outsourced",E,,,,,,https://twitter.com/experimonth,125,,,V,,,,,
1450,Eyewire,https://eyewire.org/,2012,experiment & collect/mine/extract data,9,a game to map the brain (citizen science),,"experiment, collaborative or outsourced",E/O,,,,,,https://twitter.com/eye_wire,6641,,,V,,,,,
1167,Leukippos,http://www.leukippos.org,2010,experiment & collect/mine/extract data,9,collaborative in silico synthetic biology research in the cloud,,"experiment, collaborative or outsourced",O/E,,,,,,https://twitter.com/Socrates_Logos,,,V,V,,,,,
1557,Notes from Nature,http://www.notesfromnature.org/,2013,experiment & collect/mine/extract data,9,Citizen Science project (Zooniverse) for transcription of with specimens from natural history museums ,,"experiment, collaborative or outsourced",E,,,,,,https://twitter.com/nfromn,442,,,V,,,,,
1410,OpenML,http://openml.org/,2013,experiment & collect/mine/extract data,9,"open science machine learning platform (share and collaborate on data, tasks, workflows, results)",,"experiment, collaborative or outsourced",O/E,,,,,,https://twitter.com/open_ml,3,,,V,,,,,
1201,ScienceExchange,https://www.scienceexchange.com/,2011,experiment & collect/mine/extract data,9,outsourcing experiments,,"experiment, collaborative or outsourced",E,,,,,,https://twitter.com/ScienceExchange,5598,,,V,,,,,
1297,Transcriptic,https://www.transcriptic.com/,2013,experiment & collect/mine/extract data,9,"remote, on-demand robotic life science research lab",,"experiment, collaborative or outsourced",E,,,,,,https://twitter.com/transcriptic,1182,,,V,,,,,
1353,AssayDepot,https://www.assaydepot.com,2014,experiment & collect/mine/extract data,9,pharmaceutical marketplace for life science research services (from commercial suppliers),,lab management,E,,,,,,https://twitter.com/assaydepot,1652,,,V,,,,,
1200,ELabInventory,https://www.elabinventory.com/,2011,experiment & collect/mine/extract data,9,Web-based laboratory inventory,,lab management,E,,,,,,no account,,,,V,,,,,
1608,ELIXIR Tools and Data Services Registry,https://bio.tools/,2015,experiment & collect/mine/extract data,9,provide information about analytical tools and data services for bioinformatics,,lab management,E/O,,,,,,https://twitter.com/ELIXIREurope,1648,,,,,,,,
1292,LabCritics,http://www.labcritics.com,2013,experiment & collect/mine/extract data,9,lab equipment reviews and comparisons,,lab management,E,,,,,,https://twitter.com/LabCritics,1819,,,V,,,,,
1142,Quartzy,https://www.quartzy.com/,2009,experiment & collect/mine/extract data,9,"automation of lab workflow (inventory, orders, protocols, equipment scheduling)",,lab management,E,,,,,,https://twitter.com/Quartzy,1165,,V,V,,,,,
1354,Findings App,http://findingsapp.com/,2014,experiment & collect/mine/extract data,9,electronic lab notebook (with some protocol sharing),,lab notebook,E,,,,,,https://twitter.com/FindingsApp,1987,,,V,,,,,
