ID,NAME,URL,WEBLAUNCHYEAR,PRIMEPHASEALPHA,PRIMEPHASENUMBER,FUNCTIONFREE,UI_FUNCTIONFREE,FUNCTIONCONTROLLLED,G-E-O-CATEGORY,UI_GEOCATEGORY,UI_FIELDUSE_AH,UI_FIELDUSE_SS,UI_FIELDUSE_LF,UI_FIELDUSE_PT,TWITTERACCOUNT,TWITTERFOLLOW_20160601,ACTIVEPRE,ACTIVEDIS,ACTIVEANA,ACTIVEWRI,ACTIVEPUB,ACTIVEOUT,ACTIVEASS,UI_REMARKS
1267,Open Science Framework,https://osf.io,2013,project management/planning,0,"open network of research documents, version control system, collaboration software, project management and registering; badges? also: commenting",,open project management,G,,,,,,https://twitter.com/OSFramework,5644,V,V,V,V,V,V,V,
1590,AsPredicted,https://aspredicted.org/,2015,project management/planning,0,standardized preregistration form + platform,,preregistration platform,G,,,,,,no account,,V,,,,,,,
1477,Confluence (Atlassian),https://www.atlassian.com/software/confluence,2003,project management/planning,0,team collaboration/planning,,project management,E,,,,,,https://twitter.com/Confluence,11.7K,V,,,,,,,
1542,DMP Tool,https://dmptool.org/,2011,project management/planning,0,create data mangement plans,,project management,E,,,,,,https://twitter.com/TheDMPTool,444,V,,,,,,,
1268,Projects,https://projects.ac/,2013,project management/planning,0,science project management; manage experiments and data,,project management,E,,,,,,https://twitter.com/projects,927,,,V,,,,,
1478,Innocentive,http://www.innocentive.com/,2001,crowdsource/define research priorities/ideas/collaborations,1,crowdsourced innovation,,connect researchers to research,E/O,,,,,,https://twitter.com/InnoCentive,10.1K,V,,,,,,,
1543,Syneratio,https://syneratio.com,2012,crowdsource/define research priorities/ideas/collaborations,1,crowdfunding and collaboration,,"crowdfunding platform, and more",E/O,,,,,,https://twitter.com/Syneratio,2481,V,V,V,,,,,
1158,Direct2experts,http://direct2experts.org/,2010,crowdsource/define research priorities/ideas/collaborations,1,A federated national (US) network of research networks in biomedicine,,experts search engine ,E,,,,,,no account,,V?,V?,,,,V,,
1070,Scholar Universe,http://www.scholaruniverse.com/,2005,crowdsource/define research priorities/ideas/collaborations,1,find experts,,experts search engine ,E,,,,,,no account,,V,,,,,,,
1585,AcademicLabs,http://www.academiclabs.co/,2015,researcher profiling (& social network),1,Facilitate research (group) collaboration & find matches,,matching network,E,,,,,,https://twitter.com/academiclabsco,314,,,,,,,,
1479,DHcommons,http://dhcommons.org/,2010,crowdsource/define research priorities/ideas/collaborations,1,digital humanities platform matching projects to researchers,,matching network,"O/E
",,,,,,https://twitter.com/DHCommons,2390,V,,,,,,,
1389,Journal of Brief Ideas,http://beta.briefideas.org/,2015,crowdsource/define research priorities/ideas/collaborations,1,citable online index of research ideas available for public scrutiny,,research ideas search engine,O/E,,,,,,no account,,,V,,,,V,,
1402,Thinklab,http://thinklab.com/,2015,fund / get contract,2,"Open Science platform where researchers and commenters can get paid
",,connect researchers to research,O/E,,,,,,https://twitter.com/thinklab,151,V,,,,,,,
1159,Kaggle,http://www.kaggle.com/,2010,fund / get contract,2,connect data scientists to (commercial) market; open code competitions,,contract competition,E,,,,,,https://twitter.com/kaggle,51.5K,V,,,,,,,
1269,Consano,https://www.consano.org/,2013,fund / get contract,2,non-profit curated crowdfunding for medical research projects ,,crowdfunding platform,E,,,,,,https://twitter.com/Consano,1162,V,,,,,,,
1482,Endeavorist,https://www.endeavorist.org,2014,fund / get contract,2,matching research and funds/grants,,crowdfunding platform,E/G,,,,,,https://twitter.com/EndeavoristOrg,7090,V,,,,,,,
1186,Experiment,https://experiment.com/,2011,fund / get contract,2,platform for projects looking for crowdfunding,,crowdfunding platform,E,,,,,,no account,,V,,,,,,,
1111,My Projects,http://myprojects.cancerresearchuk.org/,2008,fund / get contract,2,"showcase of research projects, public can choose which to donate to ",,crowdfunding platform,E,,,,,,https://twitter.com/MyProjects,958,V,,,,,,,
1187,Petridish,http://www.petridish.org/,2011,fund / get contract,2,curated platform of science projects for crowdfunding,,crowdfunding platform,E,,,,,,https://twitter.com/petridishorg,1084,V,,,,,,,
1136,SciFlies,http://sciflies.org/,2009,fund / get contract,2,"Organizes crowdfunding
",,crowdfunding platform,E,,,,,,https://twitter.com/SciFlies,195,V,,,,,,,
1483,SciFund,"http://scifundchallenge.org/
",2012,fund / get contract,2,support researchers in crowdfunding and science outreach activities,,crowdfunding platform,E/O,,,,,,https://twitter.com/SciFund,982,V,,,,,V,,
1481,Thinkable.org,https://thinkable.org/,2014,fund / get contract,2,"promote open & fundamental research through funding, prizes and sponsorhsips",,crowdfunding platform,"G/E
",,,,,,https://twitter.com/thinkable_org,4466,V,,,,,,,
1336,Walacea,http://walacea.com/,2014,fund / get contract,2,crowdfunding,,crowdfunding platform,E,,,,,,https://twitter.com/walacea_,1625,V,,,,,,,
1270,Foundation Directory,https://fconline.foundationcenter.org/,2013,fund / get contract,2,finding funders,,funder search,E,,,,,,https://twitter.com/fdncenter,123K,V,,,,,,,
1271,Fundref search,http://search.crossref.org/fundref,2013,fund / get contract,2,Search research funding organisations,,funder search,E,,,,,,no account,,V,,,,,,,
1480,Grant Forward,https://www.grantforward.com,2012,fund / get contract,2,Search engine for research grants,,funder search,E,,,,,,https://twitter.com/GrantForward,4,V,,,,,,,
1036,Grants.gov,http://www.grants.gov/,2002,fund / get contract,2,overview of US grants,,funder search,E,,,,,,https://twitter.com/Grantsdotgov,2988,V,,,,,,,
1272,Newton's list,http://newtonslist.crdfglobal.org/,2013,fund / get contract,2,finding funders,,funder search,E,,,,,,https://twitter.com/crdfglobal,1968,V,,,,,,,
1221,Pivot,http://pivot.cos.com/,2012,fund / get contract,2,finding funders,,funder search,E,,,,,,no account,,V,,,,,,,
1026,Research Professional,http://info.researchprofessional.com/,2000,fund / get contract,2,finding funders,,funder search,E,,,,,,https://twitter.com/ResearchRes,17,V,,,,,,,
1076,WorldCat,http://www.worldcat.org/,2006,search (lit/data/patents/code),3,"search books, articles and more; find holding libraries",,collated library catalogue search engine,E,,,,,,https://twitter.com/worldcatorg,79,,V,,,,,,
1278,Standard Analytics,http://www.standardanalytics.io/,2013,search (lit/data/patents/code),3,"making scientific information (from articles/databases) machine readable and API-accessible, adding linked data and semantic enhancements",,enhancing bibliographic records,E,,,,,,no account,,,V,V?,,V?,,,
1341,LinkNovate,http://www.linknovate.com/,2014,search (lit/data/patents/code),3,"Find experts, technology, innovative startups through non-pub sources",,experts search engine,E,,,,,,https://twitter.com/linknovate,9082,,V,,,,,,
1399,Crossref Simple Text Query,http://www.crossref.org/SimpleTextQuery/,?,search (lit/data/patents/code),3,Batch retrieving DOI's based on free style bibliography,,extracting metadata,E,,,,,PT,no account,,,V,,,,,,
1039,nanoHUB,https://nanohub.org/,2002,search (lit/data/patents/code),3,"centralized platform for computational nanotechnology research, education, and collaboration",,field specific search engine,E,,,,,,https://twitter.com/nanoHUBnews,1760,,V,V,,,,,
1112,Neuroscience Information Framework,https://www.neuinfo.org/,2008,search (lit/data/patents/code),3,"neuroscience information, tools, data or materials, stands, ontology",,field specific search engine,E,,,,,,https://twitter.com/neuinfo,35.5K,,V,,,,,,
1013,PubMed,https://www.ncbi.nlm.nih.gov/pubmed/,1997,search (lit/data/patents/code),3,discovery tool for biomedical sciences,,field specific search engine,E,,,,,,https://twitter.com/ncbi_pubmed,21.6K,,V,,,,,,
1574,PubPsych,http://www.pubpsych.eu/,2013,search (lit/data/patents/code),3,"search psychological literature, mainly European",,field specific search engine,E,,,,,,https://twitter.com/PubPsych,166,,V,,,,,,
1540,Refindit,http://www.refindit.org/,2014,search (lit/data/patents/code),3,metasearch engine for life sciences,,field specific search engine,,,,,,,https://twitter.com/findrefsfast,1,,V,,,,,,
1276,Scicurve,http://scicurve.com/,2013,search (lit/data/patents/code),3,Visual exploration of PubMed literature records,,field specific search engine,E,,,,,,https://twitter.com/scicurve,3351,,V,,,,,,
1017,CiteSeer(X),http://citeseerx.ist.psu.edu/,1998,search (lit/data/patents/code),3,"bibliographical database, citation enhanced",,"field specific search engine, citation enhanced",E,,,,,,https://twitter.com/CiteSeerX,33,,V,,,,,,
1056,GoPubMed,http://www.gopubmed.com/web/gopubmed/,2004,search (lit/data/patents/code),3,semantic search using MEDLINE corpus,,"field specific search engine, citation enhanced",E,,,,,,no account,,,V,,,,,,
1001,Medline,http://www.nlm.nih.gov/pubs/factsheets/medline.html,1964,search (lit/data/patents/code),3,index of medical literature,,"field specific search engine, citation enhanced",E,,,,,,no account,,,V,,,,,,
1114,PubGet,http://pubget.com/,2008,search (lit/data/patents/code),3,Search engine for life-science PDFs,,"field specific search engine, citation enhanced",E,,,,,,https://twitter.com/pubget,1693,,V,,,,,,
1139,Quertle,http://www.quertle.info/,2009,search (lit/data/patents/code),3,semantic search using MEDLINE corpus,,"field specific search engine, citation enhanced",E,,,,,,https://twitter.com/Quertle,381,,V,,,,,,
1014,RepEc (Research papers in Economics),http://repec.org/,1997,search (lit/data/patents/code),3,online bibliographic database for economics,,"field specific search engine, citation enhanced",E,,,,,,no account,,,V,,,,,,
1392,Open Commons of Phenomenology,http://www.ocoph.org/,2015,search (lit/data/patents/code),3,"Create open bibliographic register of phenomenological literature. Planned: full-text search, citation indexing, timeline and network visualisations, online annotations, ratings",,"field specific search engine, collaborative",O,,,,,,https://twitter.com/OpenPheno,842,,V,,,,,,
1138,PhilPapers,http://philpapers.org/,2009,search (lit/data/patents/code),3,"comprehensive citation enhanced search, archive & community for philosophy",,"field specific search engine, collaborative",E,,,,,,no account,,,V,,,V,V,(V),
1484,Chemspider,http://www.chemspider.com/,2007,search (lit/data/patents/code),3,search chemical structures by name and structure,,"field specific search engine, for chemical structures",E,,,,,,https://twitter.com/ChemSpider,3066,,V,,,,,,
1486,COD,http://www.crystallography.net/,2003,search (lit/data/patents/code),3,"Open-access collection of crystal structures of organic, inorganic, metal-organic compounds and minerals",,"field specific search engine, for crystal structures",E/O,,,,,,no account,,,V,,,,,,
1591,CERN Open Data,http://opendata.cern.ch/,2014,search (lit/data/patents/code),3,find (and use) CERN data,,"field specific search engine, for data",O,,,,,,no account,,,V,V,,,,,
1160,DataBank,http://data.worldbank.org/,2010,search (lit/data/patents/code),3,free economic/social data from World Bank,,"field specific search engine, for data",O,,,,,,https://twitter.com/worldbankdata,34.6K,,V,,,,,,
1538,DocGraph - Linea,http://linea.docgraph.org/,2015,search (lit/data/patents/code),3,"community open data platform to discover, aggregate and enrich new open healthcare datasets",,"field specific search engine, for data",O/E,,,,,,https://twitter.com/DocGraph,685,,V,,,V,,,
1539,One Repo,http://onerepo.net/,2015,search (lit/data/patents/code),3,"demo of database for all content of eventually all the world’s repositories,in uniform format, freely accessible to all as a set of web services and as harvestable data",,"field specific search engine, for data",O,,,,,,no account,,,V,,,,,,
1490,EurekaMag,http://eurekamag.com/,1998,search (lit/data/patents/code),3,"search engine for natural science literature pre-2000, including reports, reviews, meeting; uploading full-text encouraged",,"field specific search engine, for natural science",E/O,,,,,,https://twitter.com/EurekaMag,4573,,V,,,,,,
1223,SciBite,http://scibite.com,2012,search (lit/data/patents/code),3,using text-mining to track latest news in pharma/biotech (in-company and free search interface),,"field specific search engine, for news",E,,,,,,https://twitter.com/Scibite,374,,V,,,,,,
1004,GenBank,http://www.ncbi.nlm.nih.gov/genbank/,1982,search (lit/data/patents/code),3,"annotated collection of all publicly available DNA sequences, provided by NCBI",,"field specific search engine, searching DNA sequences",E,,,,,,no account,,,V,,,,,,
1191,OpenPHACTS,http://www.openphacts.org/,2011,search (lit/data/patents/code),3,open access innovation platform for drug discovery via a semantic web approach,,"field specific search engine, searching economic data",O,,,,,,https://twitter.com/Open_PHACTS,1072,,V,,,,,,
1340,Expernova,https://en.expernova.com,2014,search (lit/data/patents/code),3,search engine for innovation,,"field specific search engine, searching experts and companies",E,,,,,,https://twitter.com/Expernova,541,,V,,,,,,
1487,PaleoBioDB,https://paleobiodb.org,2000,search (lit/data/patents/code),3,"provide global, collection-based occurrence and taxonomic data for organisms of all geological ages, as well data services to allow easy access to data for independent development of applications",,"field specific search engine, searching taxonomic data of organisms",E/O,,,,,,https://twitter.com/PaleoDB,1804,,V,,,,,,
1532,Yale Image Finder,http://krauthammerlab.med.yale.edu/imagefinder,2008,search (lit/data/patents/code),3,search OA images and figures in PubMedCentral  by searching text within images,,"field specific search engine, searching text in images",E/O,,,,,,no account,,,V,,,,,,
1071,MEDIE,http://www.nactem.ac.uk/medie/search.cgi,2005,search (lit/data/patents/code),3,retrieving biomedical correlations from medline,,"field specific search engine, semantic",E,,,,,,no account,,,V,,,,,,
1529,JournalMap,https://journalmap.org/,2010,search (lit/data/patents/code),3,Search (environmental) literature based on geolocation,,"field specific search engine, with geolocations",E,,,,,,https://twitter.com/JournalMap,249,,V,,,,,,
1390,Libraccess,http://libraccess.org/,2015,search (lit/data/patents/code),3,"Not-for-profit platform, international and interdisciplinary, full text aggregating open access resources across repositories, to make them widely available.",,"full text OA aggragation, multidisciplinary",O,,,,,,https://twitter.com/Libraccess,156,,V,,,,,,
1440,OALib (search),http://www.oalib.com,2013,search (lit/data/patents/code),3,aggregate and index scholarly OA publications,,"full text OA aggragation, multidisciplinary",O/E,,,,,,https://twitter.com/OalibJ,54,,V,,,V,,,
1342,Paperity,http://paperity.org/,2014,search (lit/data/patents/code),3,multidisciplinary OA aggragation,,"full text OA aggragation, multidisciplinary",O,,,,,,https://twitter.com/Paperity,1236,,V,,,,,,
1343,ResearchPad,http://researchpad.co/,2014,search (lit/data/patents/code),3,OA search engine/ePub reader ,,"full text OA aggragation, multidisciplinary",O/E,,,,,,https://twitter.com/researchpad,7,,V,,,,,,
1400,Science Open articles/authors,https://www.scienceopen.com/home?5,2014,search (lit/data/patents/code),3,"OA aggragation, multi-field",,"full text OA aggragation, multidisciplinary",O,,,,,,https://twitter.com/Science_Open,4966,,V,,,,,,
1277,Scilit,http://www.scilit.net,2013,search (lit/data/patents/code),3,FT OA aggragation,,"full text OA aggragation, multidisciplinary",E,,,,,,no account,,,V,,,,,,
1093,DBpedia,dbpedia.org,2007,search (lit/data/patents/code),3,crowdsourced extraction of structured information from Wikipedia ,,machine readable reference,E,,,,,,no account,,,V,,,,,,
1054,CitEc (Citations in Economics),http://citec.repec.org/,2004,search (lit/data/patents/code),3,extracting references and citation from economics publications,,machine readable references,E,,,,,,https://twitter.com/repecCitEc,81,,V,,,,,,
1189,JISC Open Citations,http://opencitations.net/,2011,search (lit/data/patents/code),3,making references available,,machine readable references,E,,,,,,https://twitter.com/dshotton,219,,V,,,,,V,
1038,Metalib,http://www.exlibrisgroup.com/category/MetaLibOverview,2002,search (lit/data/patents/code),3,federated search,,metasearch engine,E,,,,,,no account,,,V,,,,,,
1569,Baidu Scholar,http://xueshu.baidu.com/,2014,search (lit/data/patents/code),3,scholarly search engine (Chinese),,multidisciplinary search engine,E,,,,,,no account,,,V,,,,,,
1444,Europeana,http://www.europeana.eu,2008,search (lit/data/patents/code),3,search documents and artefacts from the European heritage institutions,,multidisciplinary search engine,E,,,,,,https://twitter.com/Europeanaeu,25.5K,,V,,,,,,
1445,Hathi,http://www.hathitrust.org/,2008,search (lit/data/patents/code),3,preserve and disseminate collections of partner institutions in digital form,,multidisciplinary search engine,E,,,,,,https://twitter.com/hathitrust,8784,,V,,,,,,
1530,JSTOR,http://www.jstor.org/,1995,search (lit/data/patents/code),3,"database of journal articles, books and primary sources; some public domain material, back files",,multidisciplinary search engine,E,,,,,,https://twitter.com/JSTOR,35.5K,,V,,,,,,
1443,Open Grey,http://www.opengrey.eu/,2011,search (lit/data/patents/code),3,"search grey literature (in Europe), data from 1950s onwards",,multidisciplinary search engine,O/E,,,,,,https://twitter.com/GreyLitNet,1209,,V,,,,,,
1570,Recherche Isidore,http://www.rechercheisidore.fr/,2010,search (lit/data/patents/code),3,Integrated search of archives & repositories for SSH search (French),,multidisciplinary search engine,E,,,,,,https://twitter.com/rech_isidore,2356,,V,,,,,,
1485,Research-o-Matic,http://www.researchomatic.com/,2011,search (lit/data/patents/code),3,"e-library of academic research material (essays, book notes, AP notes, term papers, research papers, theses, assignments & dissertations)",,multidisciplinary search engine,E,,,,,,https://twitter.com/Researchomatic,16K,,V,,,,,,
1055,Google Scholar,http://scholar.google.com/,2004,search (lit/data/patents/code),3,index scholarly publications,,"multidisciplinary search engine, citation enhanced",E,,,,,,no account,,,V,,,,,,
1137,Microsoft Academic Search (MAS),http://academic.research.microsoft.com/,2009,search (lit/data/patents/code),3, citation index,,"multidisciplinary search engine, citation enhanced",E,,,,,,https://twitter.com/MSFTAcademic,1332,,V,,,,V,V,
1002,Science Citation Index (Web of Science),http://thomsonreuters.com/thomson-reuters-web-of-science/,1964,search (lit/data/patents/code),3,citation index,,"multidisciplinary search engine, citation enhanced",E,,,,,,https://twitter.com/webofscience,9754,,V,,,,,V,
1568,Science Open Citation Index,https://www.scienceopen.com/,2015,experiment & collect/mine/extract data,3,citation index underlying Science Open database,,"multidisciplinary search engine, citation enhanced",E,,,,,,no account,,,V,,,,,,
1057,Scopus,http://www.scopus.com,2004,search (lit/data/patents/code),3,citation indexing,,"multidisciplinary search engine, citation enhanced",E,,,,,,https://twitter.com/Scopus,17.6K,,V,,,,,(V),
1600,Semantic Scholar,https://www.semanticscholar.org/,2015,search (lit/data/patents/code),3,semantic search engine for (OA?) computer science papers ,,"multidisciplinary search engine, citation enhanced",E,,,,,,no account,,,V,,,,,,
1337,BookGenie451,http://www.bookgenie451.com,2014,search (lit/data/patents/code),3,discovering books & more,,"multidisciplinary search engine, for books",E,,,,,,https://twitter.com/BookGenie451,21,,V,,,,,,
1560,Research Data Switchboard,http://rd-switchboard.net/,2015,search (lit/data/patents/code),3,"Find connections between research datasets across ANDS, Dryad, CERN and other international repositories",,"multidisciplinary search engine, for data",E,,,,,,no account,,,V,,,,,,
1601,SHARE Notify,https://osf.io/share,2015,search (lit/data/patents/code),3,search events across the research cycle,,"multidisciplinary search engine, for events in research whole cycle",E,,,,,,no account,,,V,,,,,,
1274,Delpher,http://www.delpher.nl/,2013,search (lit/data/patents/code),3,search engine for full text search of Dutch literary and journalism heritage,,"multidisciplinary search engine, searching digitized historical documents",E,,,,,,https://twitter.com/DelpherNL,781,,V,,,,,,
1612,Open Knowledge Maps,http://openknowledgemaps.org/,2016,search (lit/data/patents/code),3,discovery tool for open science through mapping/visualization (built on PLoS Library),,"multidisciplinary search engine, visual",O,,,,,,no account,,,,,,,,,
1531,PLOS Cloud Explorer,http://groups.ischool.berkeley.edu/ploscloudexplorer/,2014,search (lit/data/patents/code),3,Visualization of PLOS articles by subject areas,,"multidisciplinary search engine, with visualization",E,,,,,,no account,,,V,,,,,,
1190,OpenEdition,http://www.openedition.org/?lang=en,2011,search (lit/data/patents/code),3,"Platform that combines calendar, blogging and OA journals/books for (French) SSH",,OA journal platform,O,,,,,,https://twitter.com/openeditionsays,6520,,V,,,,,,
1053,BASE (Bielefeld Academic Search Engine),http://www.base-search.net/,2004,search (lit/data/patents/code),3,scholarly search engine indexing repository content,,open access search engine,O,,,,,,https://twitter.com/BASEsearch,586,,V,,,,,,
1188,CORE,http://core.ac.uk/,2011,search (lit/data/patents/code),3,search across OA repositories,,open access search engine,E,,,,,,no account,,,V,,,,,,
1403,Digital Commons Network,http://network.bepress.com/,2004,search (lit/data/patents/code),3,search engine for content of repositories using BEpress software,,open access search engine,E,,,,,,no account,,,V,,,,,,
1040,OAIster,http://www.oclc.org/oaister.en.html?urlm=168646,2002,search (lit/data/patents/code),3,scholarly search engine indexing repositories,,open access search engine,O,,,,,,no account,,,V,,,,,,
1439,OpenAIRE,https://www.openaire.eu,2010,search (lit/data/patents/code),3,"knowledge infrastructure aggregating OA and funded (FP7, H2020, national) content",,open access search engine,O,,,,,,"https://twitter.com/OpenAIRE_eu
",4825,,V,,,,,,
1442,RockYourPaper,http://www.rockyourpaper.org/,2013,search (lit/data/patents/code),3,"(OA) Discovery and reference management platform focus on South Asia, Africa and Latin America",,open access search engine,O/E,,,,,,https://twitter.com/rockurpaper,160,,V,,,,,,
1116,Stack Exchange,http://stackexchange.com/sites#,2008,search (lit/data/patents/code),3,"Scholarly and non scholarly Q&A, by subject",,Q&A platform,E,,,,,,https://twitter.com/StackExchange,16.7K,,V,,,,,,
1489,WonderLib,https://wonderlib.com,2015,search (lit/data/patents/code),3,"research engine fuelled by experts: email questions, expert researcher will send back key reseources",,Q&A platform,E,,,,,,https://twitter.com/wonderlib,30,,V,,,,,,
1222,Biostars,https://www.biostars.org/,2012,search (lit/data/patents/code),3,"Q&A platform for bioinformatics, by subject",,"Q&A platform, field-specific",E,,,,,,https://twitter.com/biostarquestion,940,,V,,,,,,
1141,Wolfram Alpha,http://www.wolframalpha.com/,2009,search (lit/data/patents/code),3,computational knowledge engine,,reference,E,,,,,,https://twitter.com/Wolfram_Alpha,46.8K,,V,V,,,,,
1338,ContentMine,http://contentmine.org/,2014,search (lit/data/patents/code),3,mine facts from scientific literature,,reference (as linked data),E,,,,,,https://twitter.com/TheContentMine,1277,,V,V?,,,,,
1566,GRID,https://www.grid.ac/,2015,search (lit/data/patents/code),3,research organization directory/dataset with IDs (in JSON/CSV),,research organization directory,E,,,,,,https://twitter.com/grid_ac,239,V?,,,,V?,,V?,
1567,Orgref,http://www.orgref.org/web/download.htm,2014,search (lit/data/patents/code),3,research organization directory/dataset with IDs (in CSV),,research organization directory,E/O,,,,,,https://twitter.com/OrgRef,516,V?,,,,V?,,V?,
1404,ACI Scholarly Blog Index,http://scholar.aci.info/,2014,search (lit/data/patents/code),3,"search engine for scholarly blogposts, with LCSH",,"scholarly blog posts search engine
",E,,,,,,https://twitter.com/aciblogindex,342,,V,,,,,,
1094,mloss,mloss.org/,2007,search (lit/data/patents/code),3,Machine learning open source software - crowdsourced collection w/ focus on interoperability,,"search engine, field specific, for software",O/E,,,,,,no account,,,,V,,,,,
1273,CrossRef Metadata Search,http://search.crossref.org/,2013,search (lit/data/patents/code),3,search DOI metadata,,"search engine, for metadata",E,,,,,,no account,,,V,,,,,,
1615,Prepubmed,http://www.prepubmed.org/,2016,search (lit/data/patents/code),3,"search life science ""preprints"": indexes arXiv q-bio, PeerJ Preprints, Figshare, bioRxiv, and F1000Research",,"search engine, for preprints",E,,,,,,no account,,,V,,,,,,
1344,Science Toolbox,http://sciencetoolbox.org/,2014,search (lit/data/patents/code),3,search engine for software,,"search engine, for software",E,,,,,,https://twitter.com/ScienceToolbox,259,,V,,,,,,
1446,Biosharing,https://www.biosharing.org/,2009,search (lit/data/patents/code),3,"Portal for standards, databases and policies in the life sciences ",,"search engine, for standards and databases",E,,,,,,https://twitter.com/biosharing,318,,V,,,,,,
1115,ScienceStage,http://sciencestage.com/,2008,search (lit/data/patents/code),3,"Platform for science videos/podcasts, networking and outreach",,"search engine, for video",E/O,,,,,,https://twitter.com/sciencestage,2107,,,,,,V,,
1192,Zanran,http://www.zanran.com,2011,search (lit/data/patents/code),3,search tables in texts on the web,,"search engine, for web tables",E,,,,,,https://twitter.com/ZanranSearch,137,,V,,,,,,
